root@jg-comp3134:~# tcpdump -r 0001.pcap
reading from file 0001.pcap, link-type EN10MB (Ethernet)
23:21:58.458704 IP jg-comp3134.ssh > 142.188.231.51.60282: Flags [P.], seq 3431020216:3431020260, ack 14517258, win 501, length 44
23:21:58.459233 IP jg-comp3134.ssh > 142.188.231.51.60282: Flags [P.], seq 44:152, ack 1, win 501, length 108
23:21:58.459337 IP jg-comp3134.ssh > 142.188.231.51.60282: Flags [P.], seq 152:188, ack 1, win 501, length 36
23:21:58.464503 IP 142.188.231.51.60282 > jg-comp3134.ssh: Flags [.], ack 44, win 8358, length 0
23:21:58.464503 IP 142.188.231.51.60282 > jg-comp3134.ssh: Flags [.], ack 188, win 8357, length 0
23:21:59.407185 IP 171.81.93.86.53012 > jg-comp3134.telnet: Flags [S], seq 2808330086, win 60212, length 0
23:22:00.248068 IP 171.81.93.86.53012 > jg-comp3134.telnet: Flags [S], seq 2808330086, win 60212, length 0
23:22:02.453417 IP 190-102-49-109.redesiminternet.com.br.53032 > jg-comp3134.58720: Flags [S], seq 2808330086, win 50720, length 0
root@jg-comp3134:~#

