23:24:22.815618 IP 167.99.183.102.22 > 142.188.231.51.60282: Flags [P.], seq 3634360:3634524, ack 1441, win 501, length 164
23:24:22.815682 IP 167.99.183.102.22 > 142.188.231.51.60282: Flags [P.], seq 3634524:3634688, ack 1441, win 501, length 164
23:24:22.815743 IP 167.99.183.102.22 > 142.188.231.51.60282: Flags [P.], seq 3634688:3634852, ack 1441, win 501, length 164
23:24:22.815803 IP 167.99.183.102.22 > 142.188.231.51.60282: Flags [P.], seq 3634852:3635016, ack 1441, win 501, length 164
23:24:22.815858 IP 167.99.183.102.22 > 142.188.231.51.60282: Flags [P.], seq 3635016:3635180, ack 1441, win 501, length 164
23:24:22.815911 IP 167.99.183.102.22 > 142.188.231.51.60282: Flags [P.], seq 3635180:3635344, ack 1441, win 501, length 164
23:24:22.815963 IP 167.99.183.102.22 > 142.188.231.51.60282: Flags [P.], seq 3635344:3635508, ack 1441, win 501, length 164
23:24:22.816021 IP 167.99.183.102.22 > 142.188.231.51.60282: Flags [P.], seq 3635508:3635672, ack 1441, win 501, length 164
23:24:22.816077 IP 167.99.183.102.22 > 142.188.231.51.60282: Flags [P.], seq 3635672:3635836, ack 1441, win 501, length 164
23:24:22.816208 IP 167.99.183.102.22 > 142.188.231.51.60282: Flags [P.], seq 3635836:3636000, ack 1441, win 501, length 164
23:24:22.816288 IP 167.99.183.102.22 > 142.188.231.51.60282: Flags [P.], seq 3636000:3636164, ack 1441, win 501, length 164
23:24:22.816350 IP 167.99.183.102.22 > 142.188.231.51.60282: Flags [P.], seq 3636164:3636328, ack 1441, win 501, length 164
23:24:22.816411 IP 167.99.183.102.22 > 142.188.231.51.60282: Flags [P.], seq 3636328:3636492, ack 1441, win 501, length 164
23:24:22.816470 IP 167.99.183.102.22 > 142.188.231.51.60282: Flags [P.], seq 3636492:3636656, ack 1441, win 501, length 164
23:24:22.816529 IP 167.99.183.102.22 > 142.188.231.51.60282: Flags [P.], seq 3636656:3636820, ack 1441, win 501, length 164
23:24:22.816587 IP 167.99.183.102.22 > 142.188.231.51.60282: Flags [P.], seq 3636820:3636984, ack 1441, win 501, length 164
23:24:22.816651 IP 167.99.183.102.22 > 142.188.231.51.60282: Flags [P.], seq 3636984:3637148, ack 1441, win 501, length 164
23:24:22.816710 IP 167.99.183.102.22 > 142.188.231.51.60282: Flags [P.], seq 3637148:3637312, ack 1441, win 501, length 164
23:24:22.816771 IP 167.99.183.102.22 > 142.188.231.51.60282: Flags [P.], seq 3637312:3637476, ack 1441, win 501, length 164
23:24:22.816829 IP 167.99.183.102.22 > 142.188.231.51.60282: Flags [P.], seq 3637476:3637640, ack 1441, win 501, length 164
23:24:22.816890 IP 167.99.183.102.22 > 142.188.231.51.60282: Flags [P.], seq 3637640:3637804, ack 1441, win 501, length 164
23:24:22.816948 IP 167.99.183.102.22 > 142.188.231.51.60282: Flags [P.], seq 3637804:3637968, ack 1441, win 501, length 164
23:24:22.817005 IP 167.99.183.102.22 > 142.188.231.51.60282: Flags [P.], seq 3637968:3638132, ack 1441, win 501, length 164
23:24:22.817062 IP 167.99.183.102.22 > 142.188.231.51.60282: Flags [P.], seq 3638132:3638296, ack 1441, win 501, length 164
23:24:22.817121 IP 167.99.183.102.22 > 142.188.231.51.60282: Flags [P.], seq 3638296:3638460, ack 1441, win 501, length 164
23:24:22.817179 IP 167.99.183.102.22 > 142.188.231.51.60282: Flags [P.], seq 3638460:3638624, ack 1441, win 501, length 164
23:24:22.817237 IP 167.99.183.102.22 > 142.188.231.51.60282: Flags [P.], seq 3638624:3638788, ack 1441, win 501, length 164
23:24:22.817294 IP 167.99.183.102.22 > 142.188.231.51.60282: Flags [P.], seq 3638788:3638952, ack 1441, win 501, length 164
23:24:22.817351 IP 167.99.183.102.22 > 142.188.231.51.60282: Flags [P.], seq 3638952:3639116, ack 1441, win 501, length 164
23:24:22.817409 IP 167.99.183.102.22 > 142.188.231.51.60282: Flags [P.], seq 3639116:3639280, ack 1441, win 501, length 164
23:24:22.817471 IP 167.99.183.102.22 > 142.188.231.51.60282: Flags [P.], seq 3639280:3639444, ack 1441, win 501, length 164
23:24:22.823152 IP 142.188.231.51.60282 > 167.99.183.102.22: Flags [.], ack 3613700, win 8360, length 0
23:24:22.823152 IP 142.188.231.51.60282 > 167.99.183.102.22: Flags [.], ack 3613864, win 8359, length 0
23:24:22.823152 IP 142.188.231.51.60282 > 167.99.183.102.22: Flags [.], ack 3616768, win 8348, length 0
23:24:22.823152 IP 142.188.231.51.60282 > 167.99.183.102.22: Flags [.], ack 3617884, win 8344, options [nop,nop,sack 1 {3618048:3618212}], length 0
23:24:22.823223 IP 167.99.183.102.22 > 142.188.231.51.60282: Flags [P.], seq 3639444:3639608, ack 1441, win 501, length 164
23:24:22.823449 IP 167.99.183.102.22 > 142.188.231.51.60282: Flags [P.], seq 3639608:3640236, ack 1441, win 501, length 628
23:24:22.823521 IP 167.99.183.102.22 > 142.188.231.51.60282: Flags [P.], seq 3640236:3640400, ack 1441, win 501, length 164
23:24:22.823590 IP 167.99.183.102.22 > 142.188.231.51.60282: Flags [P.], seq 3640400:3640564, ack 1441, win 501, length 164
23:24:22.823659 IP 167.99.183.102.22 > 142.188.231.51.60282: Flags [P.], seq 3640564:3640728, ack 1441, win 501, length 164
23:24:22.823792 IP 167.99.183.102.22 > 142.188.231.51.60282: Flags [P.], seq 3640728:3640892, ack 1441, win 501, length 164
23:24:22.823853 IP 167.99.183.102.22 > 142.188.231.51.60282: Flags [P.], seq 3640892:3641056, ack 1441, win 501, length 164
23:24:22.824023 IP 142.188.231.51.60282 > 167.99.183.102.22: Flags [.], ack 3618212, win 8342, length 0
23:24:22.824023 IP 142.188.231.51.60282 > 167.99.183.102.22: Flags [.], ack 3619664, win 8337, length 0
23:24:22.824023 IP 142.188.231.51.60282 > 167.99.183.102.22: Flags [.], ack 3619664, win 8337, options [nop,nop,sack 1 {3621116:3621608}], length 0
23:24:22.824023 IP 142.188.231.51.60282 > 167.99.183.102.22: Flags [.], ack 3621608, win 8329, length 0
23:24:22.824023 IP 142.188.231.51.60282 > 167.99.183.102.22: Flags [.], ack 3621936, win 8328, length 0
23:24:22.824023 IP 142.188.231.51.60282 > 167.99.183.102.22: Flags [.], ack 3621936, win 8328, options [nop,nop,sack 1 {3622100:3622264}], length 0
23:24:22.824052 IP 167.99.183.102.22 > 142.188.231.51.60282: Flags [P.], seq 3641056:3641220, ack 1441, win 501, length 164
23:24:22.824244 IP 167.99.183.102.22 > 142.188.231.51.60282: Flags [P.], seq 3641220:3642104, ack 1441, win 501, length 884
23:24:22.824341 IP 167.99.183.102.22 > 142.188.231.51.60282: Flags [P.], seq 3642104:3642268, ack 1441, win 501, length 164
23:24:22.824390 IP 167.99.183.102.22 > 142.188.231.51.60282: Flags [P.], seq 3642268:3642432, ack 1441, win 501, length 164
23:24:22.824435 IP 167.99.183.102.22 > 142.188.231.51.60282: Flags [P.], seq 3642432:3642596, ack 1441, win 501, length 164
23:24:22.824479 IP 167.99.183.102.22 > 142.188.231.51.60282: Flags [P.], seq 3642596:3642760, ack 1441, win 501, length 164
23:24:22.824525 IP 167.99.183.102.22 > 142.188.231.51.60282: Flags [P.], seq 3642760:3642924, ack 1441, win 501, length 164
23:24:22.838402 IP 142.188.231.51.60282 > 167.99.183.102.22: Flags [.], ack 3622264, win 8326, length 0
23:24:22.838403 IP 142.188.231.51.60282 > 167.99.183.102.22: Flags [.], ack 3622592, win 8325, length 0
23:24:22.838403 IP 142.188.231.51.60282 > 167.99.183.102.22: Flags [.], ack 3622592, win 8325, options [nop,nop,sack 1 {3622756:3622920}], length 0
23:24:22.838403 IP 142.188.231.51.60282 > 167.99.183.102.22: Flags [.], ack 3622920, win 8324, length 0
23:24:22.838403 IP 142.188.231.51.60282 > 167.99.183.102.22: Flags [.], ack 3623084, win 8323, options [nop,nop,sack 1 {3623248:3623412}], length 0
23:24:22.838403 IP 142.188.231.51.60282 > 167.99.183.102.22: Flags [.], ack 3623412, win 8322, length 0
23:24:22.838403 IP 142.188.231.51.60282 > 167.99.183.102.22: Flags [.], ack 3623576, win 8321, length 0
23:24:22.838403 IP 142.188.231.51.60282 > 167.99.183.102.22: Flags [.], ack 3623904, win 8320, length 0
23:24:22.838498 IP 167.99.183.102.22 > 142.188.231.51.60282: Flags [P.], seq 3642924:3643088, ack 1441, win 501, length 164
23:24:22.838552 IP 142.188.231.51.60282 > 167.99.183.102.22: Flags [.], ack 3624232, win 8319, length 0
23:24:22.838552 IP 142.188.231.51.60282 > 167.99.183.102.22: Flags [.], ack 3624560, win 8317, length 0
23:24:22.838552 IP 142.188.231.51.60282 > 167.99.183.102.22: Flags [.], ack 3624888, win 8316, length 0
23:24:22.838552 IP 142.188.231.51.60282 > 167.99.183.102.22: Flags [.], ack 3625052, win 8316, options [nop,nop,sack 1 {3626504:3627472}], length 0
23:24:22.838552 IP 142.188.231.51.60282 > 167.99.183.102.22: Flags [.], ack 3627472, win 8306, length 0
23:24:22.838552 IP 142.188.231.51.60282 > 167.99.183.102.22: Flags [.], ack 3627636, win 8305, length 0
23:24:22.838552 IP 142.188.231.51.60282 > 167.99.183.102.22: Flags [.], ack 3627800, win 8305, options [nop,nop,sack 1 {3627964:3628128}], length 0
23:24:22.838552 IP 142.188.231.51.60282 > 167.99.183.102.22: Flags [.], ack 3628128, win 8303, length 0
23:24:22.838604 IP 142.188.231.51.60282 > 167.99.183.102.22: Flags [.], ack 3628292, win 8303, length 0
23:24:22.838604 IP 142.188.231.51.60282 > 167.99.183.102.22: Flags [.], ack 3628620, win 8302, length 0
23:24:22.838604 IP 142.188.231.51.60282 > 167.99.183.102.22: Flags [.], ack 3628948, win 8300, length 0
23:24:22.838604 IP 142.188.231.51.60282 > 167.99.183.102.22: Flags [.], ack 3629276, win 8299, length 0
23:24:22.838604 IP 142.188.231.51.60282 > 167.99.183.102.22: Flags [.], ack 3629440, win 8298, options [nop,nop,sack 1 {3629604:3629768}], length 0
23:24:22.838604 IP 142.188.231.51.60282 > 167.99.183.102.22: Flags [.], ack 3629768, win 8297, length 0
23:24:22.838604 IP 142.188.231.51.60282 > 167.99.183.102.22: Flags [.], ack 3629932, win 8296, length 0
23:24:22.838604 IP 142.188.231.51.60282 > 167.99.183.102.22: Flags [.], ack 3630260, win 8295, length 0
23:24:22.838645 IP 142.188.231.51.60282 > 167.99.183.102.22: Flags [.], ack 3630588, win 8294, length 0
23:24:22.838645 IP 142.188.231.51.60282 > 167.99.183.102.22: Flags [.], ack 3630752, win 8293, options [nop,nop,sack 1 {3630916:3631080}], length 0
23:24:22.838645 IP 142.188.231.51.60282 > 167.99.183.102.22: Flags [.], ack 3631080, win 8292, length 0
23:24:22.838645 IP 142.188.231.51.60282 > 167.99.183.102.22: Flags [.], ack 3631244, win 8291, length 0
23:24:22.838645 IP 142.188.231.51.60282 > 167.99.183.102.22: Flags [.], ack 3631408, win 8291, options [nop,nop,sack 1 {3631572:3631736}], length 0
23:24:22.838645 IP 142.188.231.51.60282 > 167.99.183.102.22: Flags [.], ack 3631736, win 8289, length 0
23:24:22.838645 IP 142.188.231.51.60282 > 167.99.183.102.22: Flags [.], ack 3631900, win 8289, length 0
23:24:22.839182 IP 142.188.231.51.60282 > 167.99.183.102.22: Flags [.], ack 3636492, win 8271, length 0
23:24:22.839182 IP 142.188.231.51.60282 > 167.99.183.102.22: Flags [.], ack 3636820, win 8270, length 0
23:24:22.839182 IP 142.188.231.51.60282 > 167.99.183.102.22: Flags [.], ack 3636984, win 8269, options [nop,nop,sack 1 {3637148:3637312}], length 0
23:24:22.839182 IP 142.188.231.51.60282 > 167.99.183.102.22: Flags [.], ack 3637312, win 8268, length 0
23:24:22.839182 IP 142.188.231.51.60282 > 167.99.183.102.22: Flags [.], ack 3637312, win 8268, options [nop,nop,sack 1 {3637476:3637640}], length 0
23:24:22.839182 IP 142.188.231.51.60282 > 167.99.183.102.22: Flags [.], ack 3637640, win 8266, length 0
23:24:22.839720 IP 167.99.183.102.22 > 142.188.231.51.60282: Flags [P.], seq 3643088:3647220, ack 1441, win 501, length 4132
23:24:22.839821 IP 167.99.183.102.22 > 142.188.231.51.60282: Flags [P.], seq 3647220:3647568, ack 1441, win 501, length 348
23:24:22.839883 IP 167.99.183.102.22 > 142.188.231.51.60282: Flags [P.], seq 3647568:3647732, ack 1441, win 501, length 164
23:24:22.839963 IP 167.99.183.102.22 > 142.188.231.51.60282: Flags [P.], seq 3647732:3647896, ack 1441, win 501, length 164
23:24:22.840034 IP 167.99.183.102.22 > 142.188.231.51.60282: Flags [P.], seq 3647896:3648060, ack 1441, win 501, length 164
23:24:22.840091 IP 167.99.183.102.22 > 142.188.231.51.60282: Flags [P.], seq 3648060:3648388, ack 1441, win 501, length 328
23:24:22.840156 IP 167.99.183.102.22 > 142.188.231.51.60282: Flags [P.], seq 3648388:3648552, ack 1441, win 501, length 164
23:24:22.840222 IP 167.99.183.102.22 > 142.188.231.51.60282: Flags [P.], seq 3648552:3648716, ack 1441, win 501, length 164
23:24:22.840270 IP 167.99.183.102.22 > 142.188.231.51.60282: Flags [P.], seq 3648716:3648880, ack 1441, win 501, length 164
23:24:22.840317 IP 167.99.183.102.22 > 142.188.231.51.60282: Flags [P.], seq 3648880:3649044, ack 1441, win 501, length 164
23:24:22.840392 IP 167.99.183.102.22 > 142.188.231.51.60282: Flags [P.], seq 3649044:3649208, ack 1441, win 501, length 164
23:24:22.840445 IP 167.99.183.102.22 > 142.188.231.51.60282: Flags [P.], seq 3649208:3649372, ack 1441, win 501, length 164
23:24:22.840533 IP 167.99.183.102.22 > 142.188.231.51.60282: Flags [P.], seq 3649372:3649536, ack 1441, win 501, length 164
23:24:22.840582 IP 167.99.183.102.22 > 142.188.231.51.60282: Flags [P.], seq 3649536:3649700, ack 1441, win 501, length 164
23:24:22.840644 IP 167.99.183.102.22 > 142.188.231.51.60282: Flags [P.], seq 3649700:3649864, ack 1441, win 501, length 164
23:24:22.840695 IP 167.99.183.102.22 > 142.188.231.51.60282: Flags [P.], seq 3649864:3650028, ack 1441, win 501, length 164
23:24:22.840743 IP 167.99.183.102.22 > 142.188.231.51.60282: Flags [P.], seq 3650028:3650192, ack 1441, win 501, length 164
23:24:22.840790 IP 167.99.183.102.22 > 142.188.231.51.60282: Flags [P.], seq 3650192:3650356, ack 1441, win 501, length 164
23:24:22.840840 IP 167.99.183.102.22 > 142.188.231.51.60282: Flags [P.], seq 3650356:3650520, ack 1441, win 501, length 164
23:24:22.840886 IP 167.99.183.102.22 > 142.188.231.51.60282: Flags [P.], seq 3650520:3650684, ack 1441, win 501, length 164
23:24:22.840932 IP 167.99.183.102.22 > 142.188.231.51.60282: Flags [P.], seq 3650684:3650848, ack 1441, win 501, length 164
23:24:22.840976 IP 167.99.183.102.22 > 142.188.231.51.60282: Flags [P.], seq 3650848:3651012, ack 1441, win 501, length 164
23:24:22.841020 IP 167.99.183.102.22 > 142.188.231.51.60282: Flags [P.], seq 3651012:3651176, ack 1441, win 501, length 164
23:24:22.841073 IP 167.99.183.102.22 > 142.188.231.51.60282: Flags [P.], seq 3651176:3651340, ack 1441, win 501, length 164
23:24:22.841146 IP 167.99.183.102.22 > 142.188.231.51.60282: Flags [P.], seq 3651340:3651504, ack 1441, win 501, length 164
23:24:22.841216 IP 167.99.183.102.22 > 142.188.231.51.60282: Flags [P.], seq 3651504:3651668, ack 1441, win 501, length 164
23:24:22.841294 IP 167.99.183.102.22 > 142.188.231.51.60282: Flags [P.], seq 3651668:3651832, ack 1441, win 501, length 164
23:24:22.841373 IP 167.99.183.102.22 > 142.188.231.51.60282: Flags [P.], seq 3651832:3651996, ack 1441, win 501, length 164
23:24:22.841449 IP 167.99.183.102.22 > 142.188.231.51.60282: Flags [P.], seq 3651996:3652160, ack 1441, win 501, length 164
23:24:22.841522 IP 167.99.183.102.22 > 142.188.231.51.60282: Flags [P.], seq 3652160:3652324, ack 1441, win 501, length 164
23:24:22.841591 IP 167.99.183.102.22 > 142.188.231.51.60282: Flags [P.], seq 3652324:3652488, ack 1441, win 501, length 164
23:24:22.841654 IP 167.99.183.102.22 > 142.188.231.51.60282: Flags [P.], seq 3652488:3652652, ack 1441, win 501, length 164
23:24:22.841710 IP 167.99.183.102.22 > 142.188.231.51.60282: Flags [P.], seq 3652652:3652816, ack 1441, win 501, length 164
23:24:22.841756 IP 167.99.183.102.22 > 142.188.231.51.60282: Flags [P.], seq 3652816:3652980, ack 1441, win 501, length 164
23:24:22.841800 IP 167.99.183.102.22 > 142.188.231.51.60282: Flags [P.], seq 3652980:3653144, ack 1441, win 501, length 164
23:24:22.841847 IP 167.99.183.102.22 > 142.188.231.51.60282: Flags [P.], seq 3653144:3653308, ack 1441, win 501, length 164
23:24:22.841893 IP 167.99.183.102.22 > 142.188.231.51.60282: Flags [P.], seq 3653308:3653472, ack 1441, win 501, length 164
23:24:22.841949 IP 167.99.183.102.22 > 142.188.231.51.60282: Flags [P.], seq 3653472:3653636, ack 1441, win 501, length 164
23:24:22.842009 IP 167.99.183.102.22 > 142.188.231.51.60282: Flags [P.], seq 3653636:3653800, ack 1441, win 501, length 164
23:24:22.842078 IP 167.99.183.102.22 > 142.188.231.51.60282: Flags [P.], seq 3653800:3653964, ack 1441, win 501, length 164
23:24:22.842163 IP 167.99.183.102.22 > 142.188.231.51.60282: Flags [P.], seq 3653964:3654128, ack 1441, win 501, length 164
23:24:22.842268 IP 167.99.183.102.22 > 142.188.231.51.60282: Flags [P.], seq 3654128:3654292, ack 1441, win 501, length 164
23:24:22.843188 IP 167.99.183.102.22 > 142.188.231.51.60282: Flags [P.], seq 3654292:3654456, ack 1441, win 501, length 164
23:24:22.843302 IP 167.99.183.102.22 > 142.188.231.51.60282: Flags [P.], seq 3654456:3654620, ack 1441, win 501, length 164
23:24:22.843384 IP 167.99.183.102.22 > 142.188.231.51.60282: Flags [P.], seq 3654620:3654784, ack 1441, win 501, length 164
23:24:22.843475 IP 167.99.183.102.22 > 142.188.231.51.60282: Flags [P.], seq 3654784:3654948, ack 1441, win 501, length 164
23:24:22.843536 IP 167.99.183.102.22 > 142.188.231.51.60282: Flags [P.], seq 3654948:3655112, ack 1441, win 501, length 164
23:24:22.843633 IP 167.99.183.102.22 > 142.188.231.51.60282: Flags [P.], seq 3655112:3655276, ack 1441, win 501, length 164
23:24:22.843703 IP 167.99.183.102.22 > 142.188.231.51.60282: Flags [P.], seq 3655276:3655440, ack 1441, win 501, length 164
23:24:22.843757 IP 167.99.183.102.22 > 142.188.231.51.60282: Flags [P.], seq 3655440:3655604, ack 1441, win 501, length 164
23:24:22.843806 IP 167.99.183.102.22 > 142.188.231.51.60282: Flags [P.], seq 3655604:3655768, ack 1441, win 501, length 164
23:24:22.843872 IP 167.99.183.102.22 > 142.188.231.51.60282: Flags [P.], seq 3655768:3655932, ack 1441, win 501, length 164
23:24:22.843926 IP 167.99.183.102.22 > 142.188.231.51.60282: Flags [P.], seq 3655932:3656096, ack 1441, win 501, length 164
23:24:22.843985 IP 167.99.183.102.22 > 142.188.231.51.60282: Flags [P.], seq 3656096:3656260, ack 1441, win 501, length 164
23:24:22.844076 IP 167.99.183.102.22 > 142.188.231.51.60282: Flags [P.], seq 3656260:3656424, ack 1441, win 501, length 164
23:24:22.844166 IP 167.99.183.102.22 > 142.188.231.51.60282: Flags [P.], seq 3656424:3656588, ack 1441, win 501, length 164
23:24:22.844236 IP 167.99.183.102.22 > 142.188.231.51.60282: Flags [P.], seq 3656588:3656752, ack 1441, win 501, length 164
23:24:22.844304 IP 167.99.183.102.22 > 142.188.231.51.60282: Flags [P.], seq 3656752:3656916, ack 1441, win 501, length 164
23:24:22.844371 IP 167.99.183.102.22 > 142.188.231.51.60282: Flags [P.], seq 3656916:3657080, ack 1441, win 501, length 164
23:24:22.844435 IP 167.99.183.102.22 > 142.188.231.51.60282: Flags [P.], seq 3657080:3657244, ack 1441, win 501, length 164
23:24:22.844594 IP 167.99.183.102.22 > 142.188.231.51.60282: Flags [P.], seq 3657244:3657408, ack 1441, win 501, length 164
23:24:22.844677 IP 167.99.183.102.22 > 142.188.231.51.60282: Flags [P.], seq 3657408:3657572, ack 1441, win 501, length 164
23:24:22.844749 IP 167.99.183.102.22 > 142.188.231.51.60282: Flags [P.], seq 3657572:3657736, ack 1441, win 501, length 164
23:24:22.844822 IP 167.99.183.102.22 > 142.188.231.51.60282: Flags [P.], seq 3657736:3657900, ack 1441, win 501, length 164
23:24:22.844887 IP 167.99.183.102.22 > 142.188.231.51.60282: Flags [P.], seq 3657900:3658064, ack 1441, win 501, length 164
23:24:22.844947 IP 167.99.183.102.22 > 142.188.231.51.60282: Flags [P.], seq 3658064:3658228, ack 1441, win 501, length 164
23:24:22.845013 IP 167.99.183.102.22 > 142.188.231.51.60282: Flags [P.], seq 3658228:3658392, ack 1441, win 501, length 164
23:24:22.845076 IP 167.99.183.102.22 > 142.188.231.51.60282: Flags [P.], seq 3658392:3658556, ack 1441, win 501, length 164
23:24:22.845145 IP 167.99.183.102.22 > 142.188.231.51.60282: Flags [P.], seq 3658556:3658720, ack 1441, win 501, length 164
23:24:22.845222 IP 167.99.183.102.22 > 142.188.231.51.60282: Flags [P.], seq 3658720:3658884, ack 1441, win 501, length 164
23:24:22.845287 IP 167.99.183.102.22 > 142.188.231.51.60282: Flags [P.], seq 3658884:3659048, ack 1441, win 501, length 164
23:24:22.845355 IP 167.99.183.102.22 > 142.188.231.51.60282: Flags [P.], seq 3659048:3659212, ack 1441, win 501, length 164
23:24:22.845420 IP 167.99.183.102.22 > 142.188.231.51.60282: Flags [P.], seq 3659212:3659376, ack 1441, win 501, length 164
23:24:22.845476 IP 167.99.183.102.22 > 142.188.231.51.60282: Flags [P.], seq 3659376:3659540, ack 1441, win 501, length 164
23:24:22.845543 IP 167.99.183.102.22 > 142.188.231.51.60282: Flags [P.], seq 3659540:3659704, ack 1441, win 501, length 164
23:24:22.845615 IP 167.99.183.102.22 > 142.188.231.51.60282: Flags [P.], seq 3659704:3659868, ack 1441, win 501, length 164
23:24:22.845673 IP 167.99.183.102.22 > 142.188.231.51.60282: Flags [P.], seq 3659868:3660032, ack 1441, win 501, length 164
23:24:22.845733 IP 167.99.183.102.22 > 142.188.231.51.60282: Flags [P.], seq 3660032:3660196, ack 1441, win 501, length 164
23:24:22.845791 IP 167.99.183.102.22 > 142.188.231.51.60282: Flags [P.], seq 3660196:3660360, ack 1441, win 501, length 164
23:24:22.845848 IP 167.99.183.102.22 > 142.188.231.51.60282: Flags [P.], seq 3660360:3660524, ack 1441, win 501, length 164
23:24:22.845902 IP 167.99.183.102.22 > 142.188.231.51.60282: Flags [P.], seq 3660524:3660688, ack 1441, win 501, length 164
23:24:22.845955 IP 167.99.183.102.22 > 142.188.231.51.60282: Flags [P.], seq 3660688:3660852, ack 1441, win 501, length 164
23:24:22.846019 IP 167.99.183.102.22 > 142.188.231.51.60282: Flags [P.], seq 3660852:3661016, ack 1441, win 501, length 164
23:24:22.846100 IP 167.99.183.102.22 > 142.188.231.51.60282: Flags [P.], seq 3661016:3661180, ack 1441, win 501, length 164
23:24:22.846192 IP 167.99.183.102.22 > 142.188.231.51.60282: Flags [P.], seq 3661180:3661344, ack 1441, win 501, length 164
23:24:22.846282 IP 167.99.183.102.22 > 142.188.231.51.60282: Flags [P.], seq 3661344:3661508, ack 1441, win 501, length 164
23:24:22.846348 IP 167.99.183.102.22 > 142.188.231.51.60282: Flags [P.], seq 3661508:3661672, ack 1441, win 501, length 164
23:24:22.846412 IP 167.99.183.102.22 > 142.188.231.51.60282: Flags [P.], seq 3661672:3661836, ack 1441, win 501, length 164
23:24:22.846470 IP 167.99.183.102.22 > 142.188.231.51.60282: Flags [P.], seq 3661836:3662000, ack 1441, win 501, length 164
23:24:22.846525 IP 167.99.183.102.22 > 142.188.231.51.60282: Flags [P.], seq 3662000:3662164, ack 1441, win 501, length 164
23:24:22.846583 IP 167.99.183.102.22 > 142.188.231.51.60282: Flags [P.], seq 3662164:3662328, ack 1441, win 501, length 164
23:24:22.846665 IP 167.99.183.102.22 > 142.188.231.51.60282: Flags [P.], seq 3662328:3662492, ack 1441, win 501, length 164
23:24:22.846732 IP 167.99.183.102.22 > 142.188.231.51.60282: Flags [P.], seq 3662492:3662656, ack 1441, win 501, length 164
23:24:22.846821 IP 167.99.183.102.22 > 142.188.231.51.60282: Flags [P.], seq 3662656:3662820, ack 1441, win 501, length 164
23:24:22.847048 IP 167.99.183.102.22 > 142.188.231.51.60282: Flags [P.], seq 3662820:3662984, ack 1441, win 501, length 164
23:24:22.847074 IP 142.188.231.51.60282 > 167.99.183.102.22: Flags [P.], seq 1441:1477, ack 3642924, win 8246, length 36
23:24:22.847171 IP 167.99.183.102.22 > 142.188.231.51.60282: Flags [P.], seq 3662984:3663268, ack 1477, win 501, length 284
23:24:22.847237 IP 167.99.183.102.22 > 142.188.231.51.60282: Flags [P.], seq 3663268:3663432, ack 1477, win 501, length 164
23:24:22.847292 IP 167.99.183.102.22 > 142.188.231.51.60282: Flags [P.], seq 3663432:3663596, ack 1477, win 501, length 164
23:24:22.847347 IP 167.99.183.102.22 > 142.188.231.51.60282: Flags [P.], seq 3663596:3663760, ack 1477, win 501, length 164
23:24:22.847402 IP 167.99.183.102.22 > 142.188.231.51.60282: Flags [P.], seq 3663760:3663924, ack 1477, win 501, length 164
23:24:22.847456 IP 167.99.183.102.22 > 142.188.231.51.60282: Flags [P.], seq 3663924:3664088, ack 1477, win 501, length 164
23:24:22.847513 IP 167.99.183.102.22 > 142.188.231.51.60282: Flags [P.], seq 3664088:3664252, ack 1477, win 501, length 164
23:24:22.847567 IP 167.99.183.102.22 > 142.188.231.51.60282: Flags [P.], seq 3664252:3664416, ack 1477, win 501, length 164
23:24:22.847620 IP 167.99.183.102.22 > 142.188.231.51.60282: Flags [P.], seq 3664416:3664580, ack 1477, win 501, length 164
23:24:22.847998 IP 142.188.231.51.60282 > 167.99.183.102.22: Flags [.], ack 3643088, win 8245, options [nop,nop,sack 1 {3644540:3645992}], length 0
23:24:22.847998 IP 142.188.231.51.60282 > 167.99.183.102.22: Flags [.], ack 3645992, win 8234, length 0
23:24:22.848021 IP 167.99.183.102.22 > 142.188.231.51.60282: Flags [P.], seq 3664580:3664744, ack 1477, win 501, length 164
23:24:22.848138 IP 167.99.183.102.22 > 142.188.231.51.60282: Flags [P.], seq 3664744:3665164, ack 1477, win 501, length 420
23:24:22.848225 IP 167.99.183.102.22 > 142.188.231.51.60282: Flags [P.], seq 3665164:3665328, ack 1477, win 501, length 164
23:24:22.850083 IP 142.188.231.51.60282 > 167.99.183.102.22: Flags [.], ack 3645992, win 8234, options [nop,nop,sack 1 {3647568:3647732}], length 0
23:24:22.850083 IP 142.188.231.51.60282 > 167.99.183.102.22: Flags [.], ack 3647220, win 8229, options [nop,nop,sack 1 {3647568:3647732}], length 0
23:24:22.850128 IP 167.99.183.102.22 > 142.188.231.51.60282: Flags [P.], seq 3665328:3665492, ack 1477, win 501, length 164
23:24:22.850171 IP 142.188.231.51.60282 > 167.99.183.102.22: Flags [.], ack 3647732, win 8227, length 0
23:24:22.850171 IP 142.188.231.51.60282 > 167.99.183.102.22: Flags [.], ack 3647896, win 8226, length 0
23:24:22.850171 IP 142.188.231.51.60282 > 167.99.183.102.22: Flags [.], ack 3648388, win 8224, length 0
23:24:22.850171 IP 142.188.231.51.60282 > 167.99.183.102.22: Flags [.], ack 3648716, win 8223, length 0
23:24:22.850171 IP 142.188.231.51.60282 > 167.99.183.102.22: Flags [.], ack 3649044, win 8222, length 0
23:24:22.850171 IP 142.188.231.51.60282 > 167.99.183.102.22: Flags [.], ack 3649044, win 8222, options [nop,nop,sack 1 {3649208:3649372}], length 0
23:24:22.850171 IP 142.188.231.51.60282 > 167.99.183.102.22: Flags [.], ack 3649372, win 8221, length 0
23:24:22.850171 IP 142.188.231.51.60282 > 167.99.183.102.22: Flags [.], ack 3649372, win 8221, options [nop,nop,sack 1 {3649536:3649700}], length 0
23:24:22.850216 IP 142.188.231.51.60282 > 167.99.183.102.22: Flags [.], ack 3649700, win 8219, length 0
23:24:22.850216 IP 142.188.231.51.60282 > 167.99.183.102.22: Flags [.], ack 3650028, win 8218, length 0
23:24:22.850216 IP 142.188.231.51.60282 > 167.99.183.102.22: Flags [.], ack 3650356, win 8217, length 0
23:24:22.850216 IP 142.188.231.51.60282 > 167.99.183.102.22: Flags [.], ack 3650684, win 8215, length 0
23:24:22.850216 IP 142.188.231.51.60282 > 167.99.183.102.22: Flags [.], ack 3650684, win 8215, options [nop,nop,sack 1 {3650848:3651012}], length 0
23:24:22.850216 IP 142.188.231.51.60282 > 167.99.183.102.22: Flags [.], ack 3651012, win 8214, length 0
23:24:22.850216 IP 142.188.231.51.60282 > 167.99.183.102.22: Flags [.], ack 3651012, win 8214, options [nop,nop,sack 1 {3651176:3651340}], length 0
23:24:22.850217 IP 142.188.231.51.60282 > 167.99.183.102.22: Flags [.], ack 3651340, win 8213, length 0
23:24:22.850252 IP 142.188.231.51.60282 > 167.99.183.102.22: Flags [.], ack 3651668, win 8212, length 0
23:24:22.850252 IP 142.188.231.51.60282 > 167.99.183.102.22: Flags [.], ack 3651832, win 8211, options [nop,nop,sack 1 {3651996:3652160}], length 0
23:24:22.850252 IP 142.188.231.51.60282 > 167.99.183.102.22: Flags [.], ack 3652160, win 8210, length 0
23:24:22.850252 IP 142.188.231.51.60282 > 167.99.183.102.22: Flags [.], ack 3652324, win 8209, length 0
23:24:22.850252 IP 142.188.231.51.60282 > 167.99.183.102.22: Flags [.], ack 3652652, win 8208, length 0
23:24:22.850252 IP 142.188.231.51.60282 > 167.99.183.102.22: Flags [.], ack 3652980, win 8206, length 0
23:24:22.850252 IP 142.188.231.51.60282 > 167.99.183.102.22: Flags [.], ack 3653308, win 8205, length 0
23:24:22.850252 IP 142.188.231.51.60282 > 167.99.183.102.22: Flags [.], ack 3653308, win 8205, options [nop,nop,sack 1 {3653472:3653636}], length 0
23:24:22.850294 IP 142.188.231.51.60282 > 167.99.183.102.22: Flags [.], ack 3653636, win 8204, length 0
23:24:22.850294 IP 142.188.231.51.60282 > 167.99.183.102.22: Flags [.], ack 3653636, win 8204, options [nop,nop,sack 1 {3653800:3653964}], length 0
23:24:22.850294 IP 142.188.231.51.60282 > 167.99.183.102.22: Flags [.], ack 3653964, win 8203, length 0
23:24:22.850747 IP 167.99.183.102.22 > 142.188.231.51.60282: Flags [P.], seq 3665492:3669096, ack 1477, win 501, length 3604
23:24:22.850855 IP 167.99.183.102.22 > 142.188.231.51.60282: Flags [P.], seq 3669096:3669260, ack 1477, win 501, length 164
23:24:22.851025 IP 167.99.183.102.22 > 142.188.231.51.60282: Flags [P.], seq 3669260:3669424, ack 1477, win 501, length 164
23:24:22.851095 IP 167.99.183.102.22 > 142.188.231.51.60282: Flags [P.], seq 3669424:3669588, ack 1477, win 501, length 164
23:24:22.851170 IP 167.99.183.102.22 > 142.188.231.51.60282: Flags [P.], seq 3669588:3669752, ack 1477, win 501, length 164
23:24:22.851252 IP 167.99.183.102.22 > 142.188.231.51.60282: Flags [P.], seq 3669752:3669916, ack 1477, win 501, length 164
23:24:22.851316 IP 167.99.183.102.22 > 142.188.231.51.60282: Flags [P.], seq 3669916:3670080, ack 1477, win 501, length 164
23:24:22.851384 IP 167.99.183.102.22 > 142.188.231.51.60282: Flags [P.], seq 3670080:3670244, ack 1477, win 501, length 164
23:24:22.851454 IP 167.99.183.102.22 > 142.188.231.51.60282: Flags [P.], seq 3670244:3670408, ack 1477, win 501, length 164
23:24:22.851526 IP 167.99.183.102.22 > 142.188.231.51.60282: Flags [P.], seq 3670408:3670572, ack 1477, win 501, length 164
23:24:22.851594 IP 167.99.183.102.22 > 142.188.231.51.60282: Flags [P.], seq 3670572:3670736, ack 1477, win 501, length 164
23:24:22.851667 IP 167.99.183.102.22 > 142.188.231.51.60282: Flags [P.], seq 3670736:3670900, ack 1477, win 501, length 164
23:24:22.851737 IP 167.99.183.102.22 > 142.188.231.51.60282: Flags [P.], seq 3670900:3671064, ack 1477, win 501, length 164
23:24:22.851805 IP 167.99.183.102.22 > 142.188.231.51.60282: Flags [P.], seq 3671064:3671228, ack 1477, win 501, length 164
23:24:22.851873 IP 167.99.183.102.22 > 142.188.231.51.60282: Flags [P.], seq 3671228:3671392, ack 1477, win 501, length 164
23:24:22.852075 IP 142.188.231.51.60282 > 167.99.183.102.22: Flags [.], ack 3654128, win 8202, options [nop,nop,sack 1 {3654292:3654456}], length 0
23:24:22.852075 IP 142.188.231.51.60282 > 167.99.183.102.22: Flags [.], ack 3654128, win 8202, options [nop,nop,sack 2 {3654620:3654784}{3654292:3654456}], length 0
23:24:22.852075 IP 142.188.231.51.60282 > 167.99.183.102.22: Flags [.], ack 3654128, win 8202, options [nop,nop,sack 2 {3654620:3654948}{3654292:3654456}], length 0
23:24:22.852075 IP 142.188.231.51.60282 > 167.99.183.102.22: Flags [.], ack 3654456, win 8201, options [nop,nop,sack 1 {3654620:3654948}], length 0
23:24:22.852075 IP 142.188.231.51.60282 > 167.99.183.102.22: Flags [.], ack 3654948, win 8199, length 0
23:24:22.852075 IP 142.188.231.51.60282 > 167.99.183.102.22: Flags [.], ack 3655112, win 8198, length 0
23:24:22.852075 IP 142.188.231.51.60282 > 167.99.183.102.22: Flags [.], ack 3655440, win 8197, length 0
23:24:22.852075 IP 142.188.231.51.60282 > 167.99.183.102.22: Flags [.], ack 3655768, win 8196, length 0
23:24:22.852108 IP 167.99.183.102.22 > 142.188.231.51.60282: Flags [P.], seq 3671392:3671556, ack 1477, win 501, length 164
23:24:22.852320 IP 167.99.183.102.22 > 142.188.231.51.60282: Flags [P.], seq 3671556:3672768, ack 1477, win 501, length 1212
23:24:22.852411 IP 167.99.183.102.22 > 142.188.231.51.60282: Flags [P.], seq 3672768:3672932, ack 1477, win 501, length 164
23:24:22.852489 IP 167.99.183.102.22 > 142.188.231.51.60282: Flags [P.], seq 3672932:3673096, ack 1477, win 501, length 164
23:24:22.852566 IP 167.99.183.102.22 > 142.188.231.51.60282: Flags [P.], seq 3673096:3673260, ack 1477, win 501, length 164
23:24:22.852642 IP 167.99.183.102.22 > 142.188.231.51.60282: Flags [P.], seq 3673260:3673424, ack 1477, win 501, length 164
23:24:22.852710 IP 167.99.183.102.22 > 142.188.231.51.60282: Flags [P.], seq 3673424:3673588, ack 1477, win 501, length 164
23:24:22.852771 IP 167.99.183.102.22 > 142.188.231.51.60282: Flags [P.], seq 3673588:3673752, ack 1477, win 501, length 164
23:24:22.852831 IP 167.99.183.102.22 > 142.188.231.51.60282: Flags [P.], seq 3673752:3673916, ack 1477, win 501, length 164
23:24:22.852891 IP 167.99.183.102.22 > 142.188.231.51.60282: Flags [P.], seq 3673916:3674080, ack 1477, win 501, length 164
23:24:22.852951 IP 167.99.183.102.22 > 142.188.231.51.60282: Flags [P.], seq 3674080:3674244, ack 1477, win 501, length 164
23:24:22.853011 IP 167.99.183.102.22 > 142.188.231.51.60282: Flags [P.], seq 3674244:3674408, ack 1477, win 501, length 164
23:24:22.853077 IP 167.99.183.102.22 > 142.188.231.51.60282: Flags [P.], seq 3674408:3674572, ack 1477, win 501, length 164
23:24:22.853108 IP 142.188.231.51.60282 > 167.99.183.102.22: Flags [.], ack 3655932, win 8195, options [nop,nop,sack 1 {3656096:3656260}], length 0
23:24:22.853108 IP 142.188.231.51.60282 > 167.99.183.102.22: Flags [.], ack 3656260, win 8194, length 0
23:24:22.853108 IP 142.188.231.51.60282 > 167.99.183.102.22: Flags [.], ack 3656424, win 8193, length 0
23:24:22.853108 IP 142.188.231.51.60282 > 167.99.183.102.22: Flags [.], ack 3656752, win 8192, length 0
23:24:22.853108 IP 142.188.231.51.60282 > 167.99.183.102.22: Flags [.], ack 3657080, win 8190, length 0
23:24:22.853108 IP 142.188.231.51.60282 > 167.99.183.102.22: Flags [.], ack 3657408, win 8189, length 0
23:24:22.853108 IP 142.188.231.51.60282 > 167.99.183.102.22: Flags [.], ack 3657408, win 8189, options [nop,nop,sack 1 {3657572:3657736}], length 0
23:24:22.853108 IP 142.188.231.51.60282 > 167.99.183.102.22: Flags [.], ack 3657736, win 8188, length 0
23:24:22.853156 IP 142.188.231.51.60282 > 167.99.183.102.22: Flags [.], ack 3658064, win 8187, length 0
23:24:22.853157 IP 142.188.231.51.60282 > 167.99.183.102.22: Flags [.], ack 3658228, win 8186, options [nop,nop,sack 1 {3658392:3658556}], length 0
23:24:22.853157 IP 142.188.231.51.60282 > 167.99.183.102.22: Flags [.], ack 3658556, win 8185, length 0
23:24:22.853157 IP 142.188.231.51.60282 > 167.99.183.102.22: Flags [.], ack 3658720, win 8184, length 0
23:24:22.853157 IP 142.188.231.51.60282 > 167.99.183.102.22: Flags [.], ack 3659048, win 8183, length 0
23:24:22.853157 IP 142.188.231.51.60282 > 167.99.183.102.22: Flags [.], ack 3659376, win 8181, length 0
23:24:22.853157 IP 142.188.231.51.60282 > 167.99.183.102.22: Flags [.], ack 3659540, win 8181, options [nop,nop,sack 1 {3659704:3659868}], length 0
23:24:22.853157 IP 142.188.231.51.60282 > 167.99.183.102.22: Flags [.], ack 3659868, win 8180, length 0
23:24:22.853189 IP 142.188.231.51.60282 > 167.99.183.102.22: Flags [.], ack 3660032, win 8179, length 0
23:24:22.853189 IP 142.188.231.51.60282 > 167.99.183.102.22: Flags [.], ack 3660196, win 8178, options [nop,nop,sack 1 {3660360:3660524}], length 0
23:24:22.853189 IP 142.188.231.51.60282 > 167.99.183.102.22: Flags [.], ack 3660524, win 8177, length 0
23:24:22.853189 IP 142.188.231.51.60282 > 167.99.183.102.22: Flags [.], ack 3660688, win 8176, length 0
23:24:22.853485 IP 167.99.183.102.22 > 142.188.231.51.60282: Flags [P.], seq 3674572:3677056, ack 1477, win 501, length 2484
23:24:22.853822 IP 167.99.183.102.22 > 142.188.231.51.60282: Flags [P.], seq 3677056:3677220, ack 1477, win 501, length 164
23:24:22.853890 IP 167.99.183.102.22 > 142.188.231.51.60282: Flags [P.], seq 3677220:3677384, ack 1477, win 501, length 164
23:24:22.854102 IP 167.99.183.102.22 > 142.188.231.51.60282: Flags [P.], seq 3677384:3677548, ack 1477, win 501, length 164
23:24:22.854171 IP 167.99.183.102.22 > 142.188.231.51.60282: Flags [P.], seq 3677548:3677712, ack 1477, win 501, length 164
23:24:22.854232 IP 167.99.183.102.22 > 142.188.231.51.60282: Flags [P.], seq 3677712:3677876, ack 1477, win 501, length 164
23:24:22.854290 IP 167.99.183.102.22 > 142.188.231.51.60282: Flags [P.], seq 3677876:3678040, ack 1477, win 501, length 164
23:24:22.854470 IP 167.99.183.102.22 > 142.188.231.51.60282: Flags [P.], seq 3678040:3678204, ack 1477, win 501, length 164
23:24:22.854539 IP 167.99.183.102.22 > 142.188.231.51.60282: Flags [P.], seq 3678204:3678368, ack 1477, win 501, length 164
23:24:22.854684 IP 167.99.183.102.22 > 142.188.231.51.60282: Flags [P.], seq 3678368:3678532, ack 1477, win 501, length 164
23:24:22.854746 IP 167.99.183.102.22 > 142.188.231.51.60282: Flags [P.], seq 3678532:3678696, ack 1477, win 501, length 164
23:24:22.854839 IP 167.99.183.102.22 > 142.188.231.51.60282: Flags [P.], seq 3678696:3678860, ack 1477, win 501, length 164
23:24:22.855107 IP 142.188.231.51.60282 > 167.99.183.102.22: Flags [.], ack 3660852, win 8176, options [nop,nop,sack 1 {3661016:3661180}], length 0
23:24:22.855108 IP 142.188.231.51.60282 > 167.99.183.102.22: Flags [.], ack 3661180, win 8174, length 0
23:24:22.855108 IP 142.188.231.51.60282 > 167.99.183.102.22: Flags [.], ack 3661344, win 8174, length 0
23:24:22.855108 IP 142.188.231.51.60282 > 167.99.183.102.22: Flags [.], ack 3661672, win 8172, length 0
23:24:22.855108 IP 142.188.231.51.60282 > 167.99.183.102.22: Flags [.], ack 3662000, win 8171, length 0
23:24:22.855108 IP 142.188.231.51.60282 > 167.99.183.102.22: Flags [.], ack 3662164, win 8171, options [nop,nop,sack 1 {3662328:3662492}], length 0
23:24:22.855108 IP 142.188.231.51.60282 > 167.99.183.102.22: Flags [.], ack 3662492, win 8169, length 0
23:24:22.855108 IP 142.188.231.51.60282 > 167.99.183.102.22: Flags [.], ack 3662656, win 8169, length 0
23:24:22.855206 IP 167.99.183.102.22 > 142.188.231.51.60282: Flags [P.], seq 3678860:3679024, ack 1477, win 501, length 164
23:24:22.855374 IP 167.99.183.102.22 > 142.188.231.51.60282: Flags [P.], seq 3679024:3680116, ack 1477, win 501, length 1092
23:24:22.855454 IP 167.99.183.102.22 > 142.188.231.51.60282: Flags [P.], seq 3680116:3680280, ack 1477, win 501, length 164
23:24:22.855521 IP 167.99.183.102.22 > 142.188.231.51.60282: Flags [P.], seq 3680280:3680444, ack 1477, win 501, length 164
23:24:22.855623 IP 167.99.183.102.22 > 142.188.231.51.60282: Flags [P.], seq 3680444:3680608, ack 1477, win 501, length 164
23:24:22.855760 IP 167.99.183.102.22 > 142.188.231.51.60282: Flags [P.], seq 3680608:3680772, ack 1477, win 501, length 164
23:24:22.855842 IP 167.99.183.102.22 > 142.188.231.51.60282: Flags [P.], seq 3680772:3680936, ack 1477, win 501, length 164
23:24:22.855999 IP 167.99.183.102.22 > 142.188.231.51.60282: Flags [P.], seq 3680936:3681100, ack 1477, win 501, length 164
23:24:22.856025 IP 142.188.231.51.60282 > 167.99.183.102.22: Flags [.], ack 3662656, win 8169, options [nop,nop,sack 1 {3662820:3662984}], length 0
23:24:22.856025 IP 142.188.231.51.60282 > 167.99.183.102.22: Flags [.], ack 3662984, win 8167, length 0
23:24:22.856025 IP 142.188.231.51.60282 > 167.99.183.102.22: Flags [.], ack 3663432, win 8166, length 0
23:24:22.856025 IP 142.188.231.51.60282 > 167.99.183.102.22: Flags [.], ack 3663760, win 8164, length 0
23:24:22.856025 IP 142.188.231.51.60282 > 167.99.183.102.22: Flags [.], ack 3663760, win 8164, options [nop,nop,sack 1 {3663924:3664088}], length 0
23:24:22.856166 IP 167.99.183.102.22 > 142.188.231.51.60282: Flags [P.], seq 3681100:3681872, ack 1477, win 501, length 772
23:24:22.856237 IP 167.99.183.102.22 > 142.188.231.51.60282: Flags [P.], seq 3681872:3682036, ack 1477, win 501, length 164
23:24:22.856295 IP 167.99.183.102.22 > 142.188.231.51.60282: Flags [P.], seq 3682036:3682200, ack 1477, win 501, length 164
23:24:22.856364 IP 167.99.183.102.22 > 142.188.231.51.60282: Flags [P.], seq 3682200:3682364, ack 1477, win 501, length 164
23:24:22.856425 IP 167.99.183.102.22 > 142.188.231.51.60282: Flags [P.], seq 3682364:3682528, ack 1477, win 501, length 164
23:24:22.856484 IP 167.99.183.102.22 > 142.188.231.51.60282: Flags [P.], seq 3682528:3682692, ack 1477, win 501, length 164
23:24:22.856543 IP 167.99.183.102.22 > 142.188.231.51.60282: Flags [P.], seq 3682692:3682856, ack 1477, win 501, length 164
23:24:22.856604 IP 167.99.183.102.22 > 142.188.231.51.60282: Flags [P.], seq 3682856:3683020, ack 1477, win 501, length 164
23:24:22.856665 IP 167.99.183.102.22 > 142.188.231.51.60282: Flags [P.], seq 3683020:3683184, ack 1477, win 501, length 164
23:24:22.856725 IP 167.99.183.102.22 > 142.188.231.51.60282: Flags [P.], seq 3683184:3683348, ack 1477, win 501, length 164
23:24:22.856784 IP 167.99.183.102.22 > 142.188.231.51.60282: Flags [P.], seq 3683348:3683512, ack 1477, win 501, length 164
23:24:22.856843 IP 167.99.183.102.22 > 142.188.231.51.60282: Flags [P.], seq 3683512:3683676, ack 1477, win 501, length 164
23:24:22.856903 IP 167.99.183.102.22 > 142.188.231.51.60282: Flags [P.], seq 3683676:3683840, ack 1477, win 501, length 164
23:24:22.857096 IP 167.99.183.102.22 > 142.188.231.51.60282: Flags [P.], seq 3683840:3684004, ack 1477, win 501, length 164
23:24:22.857225 IP 167.99.183.102.22 > 142.188.231.51.60282: Flags [P.], seq 3684004:3684168, ack 1477, win 501, length 164
23:24:22.857309 IP 167.99.183.102.22 > 142.188.231.51.60282: Flags [P.], seq 3684168:3684332, ack 1477, win 501, length 164
23:24:22.857375 IP 167.99.183.102.22 > 142.188.231.51.60282: Flags [P.], seq 3684332:3684496, ack 1477, win 501, length 164
23:24:22.857437 IP 167.99.183.102.22 > 142.188.231.51.60282: Flags [P.], seq 3684496:3684660, ack 1477, win 501, length 164
23:24:22.857494 IP 167.99.183.102.22 > 142.188.231.51.60282: Flags [P.], seq 3684660:3684824, ack 1477, win 501, length 164
23:24:22.857550 IP 167.99.183.102.22 > 142.188.231.51.60282: Flags [P.], seq 3684824:3684988, ack 1477, win 501, length 164
23:24:22.857610 IP 167.99.183.102.22 > 142.188.231.51.60282: Flags [P.], seq 3684988:3685152, ack 1477, win 501, length 164
23:24:22.857675 IP 167.99.183.102.22 > 142.188.231.51.60282: Flags [P.], seq 3685152:3685316, ack 1477, win 501, length 164
23:24:22.857740 IP 167.99.183.102.22 > 142.188.231.51.60282: Flags [P.], seq 3685316:3685480, ack 1477, win 501, length 164
23:24:22.857797 IP 167.99.183.102.22 > 142.188.231.51.60282: Flags [P.], seq 3685480:3685644, ack 1477, win 501, length 164
23:24:22.857853 IP 167.99.183.102.22 > 142.188.231.51.60282: Flags [P.], seq 3685644:3685808, ack 1477, win 501, length 164
23:24:22.857914 IP 167.99.183.102.22 > 142.188.231.51.60282: Flags [P.], seq 3685808:3685972, ack 1477, win 501, length 164
23:24:22.857981 IP 167.99.183.102.22 > 142.188.231.51.60282: Flags [P.], seq 3685972:3686136, ack 1477, win 501, length 164
23:24:22.858040 IP 167.99.183.102.22 > 142.188.231.51.60282: Flags [P.], seq 3686136:3686300, ack 1477, win 501, length 164
23:24:22.858251 IP 167.99.183.102.22 > 142.188.231.51.60282: Flags [P.], seq 3686300:3686464, ack 1477, win 501, length 164
23:24:22.858319 IP 167.99.183.102.22 > 142.188.231.51.60282: Flags [P.], seq 3686464:3686628, ack 1477, win 501, length 164
23:24:22.858379 IP 167.99.183.102.22 > 142.188.231.51.60282: Flags [P.], seq 3686628:3686792, ack 1477, win 501, length 164
23:24:22.858438 IP 167.99.183.102.22 > 142.188.231.51.60282: Flags [P.], seq 3686792:3686956, ack 1477, win 501, length 164
23:24:22.858819 IP 167.99.183.102.22 > 142.188.231.51.60282: Flags [P.], seq 3686956:3687120, ack 1477, win 501, length 164
23:24:22.859223 IP 167.99.183.102.22 > 142.188.231.51.60282: Flags [P.], seq 3687120:3687284, ack 1477, win 501, length 164
23:24:22.859400 IP 167.99.183.102.22 > 142.188.231.51.60282: Flags [P.], seq 3687284:3687448, ack 1477, win 501, length 164
23:24:22.859492 IP 167.99.183.102.22 > 142.188.231.51.60282: Flags [P.], seq 3687448:3687612, ack 1477, win 501, length 164
23:24:22.859560 IP 167.99.183.102.22 > 142.188.231.51.60282: Flags [P.], seq 3687612:3687776, ack 1477, win 501, length 164
23:24:22.860941 IP 142.188.231.51.60282 > 167.99.183.102.22: Flags [.], ack 3664088, win 8163, length 0
23:24:22.860941 IP 142.188.231.51.60282 > 167.99.183.102.22: Flags [.], ack 3664416, win 8162, length 0
23:24:22.860941 IP 142.188.231.51.60282 > 167.99.183.102.22: Flags [.], ack 3664580, win 8161, options [nop,nop,sack 1 {3665164:3665328}], length 0
23:24:22.860941 IP 142.188.231.51.60282 > 167.99.183.102.22: Flags [.], ack 3664744, win 8160, options [nop,nop,sack 1 {3665164:3665328}], length 0
23:24:22.860941 IP 142.188.231.51.60282 > 167.99.183.102.22: Flags [.], ack 3665328, win 8158, length 0
23:24:22.860941 IP 142.188.231.51.60282 > 167.99.183.102.22: Flags [.], ack 3665492, win 8158, length 0
23:24:22.860942 IP 142.188.231.51.60282 > 167.99.183.102.22: Flags [.], ack 3665492, win 8158, options [nop,nop,sack 1 {3666944:3668396}], length 0
23:24:22.860942 IP 142.188.231.51.60282 > 167.99.183.102.22: Flags [.], ack 3668396, win 8146, length 0
23:24:22.861012 IP 167.99.183.102.22 > 142.188.231.51.60282: Flags [P.], seq 3687776:3687940, ack 1477, win 501, length 164
23:24:22.861762 IP 142.188.231.51.60282 > 167.99.183.102.22: Flags [.], ack 3669260, win 8143, length 0
23:24:22.861763 IP 142.188.231.51.60282 > 167.99.183.102.22: Flags [.], ack 3669424, win 8142, options [nop,nop,sack 1 {3669588:3669752}], length 0
23:24:22.861763 IP 142.188.231.51.60282 > 167.99.183.102.22: Flags [.], ack 3669752, win 8141, length 0
23:24:22.861763 IP 142.188.231.51.60282 > 167.99.183.102.22: Flags [.], ack 3669916, win 8140, length 0
23:24:22.861763 IP 142.188.231.51.60282 > 167.99.183.102.22: Flags [.], ack 3670244, win 8139, length 0
23:24:22.861763 IP 142.188.231.51.60282 > 167.99.183.102.22: Flags [.], ack 3670244, win 8139, options [nop,nop,sack 1 {3670408:3670572}], length 0
23:24:22.861763 IP 142.188.231.51.60282 > 167.99.183.102.22: Flags [.], ack 3670572, win 8138, length 0
23:24:22.861763 IP 142.188.231.51.60282 > 167.99.183.102.22: Flags [.], ack 3670572, win 8138, options [nop,nop,sack 1 {3670736:3670900}], length 0
23:24:22.861803 IP 142.188.231.51.60282 > 167.99.183.102.22: Flags [.], ack 3670900, win 8136, length 0
23:24:22.861803 IP 142.188.231.51.60282 > 167.99.183.102.22: Flags [.], ack 3671064, win 8136, options [nop,nop,sack 1 {3671228:3671392}], length 0
23:24:22.861803 IP 142.188.231.51.60282 > 167.99.183.102.22: Flags [.], ack 3671392, win 8134, length 0
23:24:22.861803 IP 142.188.231.51.60282 > 167.99.183.102.22: Flags [.], ack 3671556, win 8134, length 0
23:24:22.862029 IP 142.188.231.51.60282 > 167.99.183.102.22: Flags [.], ack 3671556, win 8134, options [nop,nop,sack 1 {3672768:3672932}], length 0
23:24:22.862029 IP 142.188.231.51.60282 > 167.99.183.102.22: Flags [.], ack 3672932, win 8128, length 0
23:24:22.862029 IP 142.188.231.51.60282 > 167.99.183.102.22: Flags [.], ack 3672932, win 8128, options [nop,nop,sack 1 {3673096:3673260}], length 0
23:24:22.862029 IP 142.188.231.51.60282 > 167.99.183.102.22: Flags [.], ack 3673260, win 8127, length 0
23:24:22.862029 IP 142.188.231.51.60282 > 167.99.183.102.22: Flags [.], ack 3673588, win 8126, length 0
23:24:22.862029 IP 142.188.231.51.60282 > 167.99.183.102.22: Flags [.], ack 3673916, win 8125, length 0
23:24:22.862029 IP 142.188.231.51.60282 > 167.99.183.102.22: Flags [.], ack 3674244, win 8123, length 0
23:24:22.862365 IP 167.99.183.102.22 > 142.188.231.51.60282: Flags [P.], seq 3687940:3691336, ack 1477, win 501, length 3396
23:24:22.862651 IP 167.99.183.102.22 > 142.188.231.51.60282: Flags [P.], seq 3691336:3691500, ack 1477, win 501, length 164
23:24:22.862743 IP 167.99.183.102.22 > 142.188.231.51.60282: Flags [P.], seq 3691500:3691664, ack 1477, win 501, length 164
23:24:22.862836 IP 167.99.183.102.22 > 142.188.231.51.60282: Flags [P.], seq 3691664:3691828, ack 1477, win 501, length 164
23:24:22.863063 IP 167.99.183.102.22 > 142.188.231.51.60282: Flags [P.], seq 3691828:3691992, ack 1477, win 501, length 164
23:24:22.863099 IP 142.188.231.51.60282 > 167.99.183.102.22: Flags [.], ack 3674572, win 8122, length 0
23:24:22.863099 IP 142.188.231.51.60282 > 167.99.183.102.22: Flags [.], ack 3674572, win 8122, options [nop,nop,sack 1 {3676024:3677056}], length 0
23:24:22.863202 IP 167.99.183.102.22 > 142.188.231.51.60282: Flags [P.], seq 3691992:3692412, ack 1477, win 501, length 420
23:24:22.863275 IP 167.99.183.102.22 > 142.188.231.51.60282: Flags [P.], seq 3692412:3692576, ack 1477, win 501, length 164
23:24:22.863367 IP 167.99.183.102.22 > 142.188.231.51.60282: Flags [P.], seq 3692576:3692740, ack 1477, win 501, length 164
23:24:22.863433 IP 167.99.183.102.22 > 142.188.231.51.60282: Flags [P.], seq 3692740:3692904, ack 1477, win 501, length 164
23:24:22.863498 IP 167.99.183.102.22 > 142.188.231.51.60282: Flags [P.], seq 3692904:3693068, ack 1477, win 501, length 164
23:24:22.863561 IP 167.99.183.102.22 > 142.188.231.51.60282: Flags [P.], seq 3693068:3693232, ack 1477, win 501, length 164
23:24:22.863635 IP 167.99.183.102.22 > 142.188.231.51.60282: Flags [P.], seq 3693232:3693396, ack 1477, win 501, length 164
23:24:22.863717 IP 167.99.183.102.22 > 142.188.231.51.60282: Flags [P.], seq 3693396:3693560, ack 1477, win 501, length 164
23:24:22.863787 IP 167.99.183.102.22 > 142.188.231.51.60282: Flags [P.], seq 3693560:3693724, ack 1477, win 501, length 164
23:24:22.863894 IP 167.99.183.102.22 > 142.188.231.51.60282: Flags [P.], seq 3693724:3693888, ack 1477, win 501, length 164
23:24:22.863950 IP 167.99.183.102.22 > 142.188.231.51.60282: Flags [P.], seq 3693888:3694052, ack 1477, win 501, length 164
23:24:22.864001 IP 167.99.183.102.22 > 142.188.231.51.60282: Flags [P.], seq 3694052:3694216, ack 1477, win 501, length 164
23:24:22.864128 IP 142.188.231.51.60282 > 167.99.183.102.22: Flags [.], ack 3677056, win 8112, length 0
23:24:22.864128 IP 142.188.231.51.60282 > 167.99.183.102.22: Flags [.], ack 3677220, win 8112, options [nop,nop,sack 1 {3677384:3677548}], length 0
23:24:22.864128 IP 142.188.231.51.60282 > 167.99.183.102.22: Flags [.], ack 3677220, win 8112, options [nop,nop,sack 2 {3677712:3677876}{3677384:3677548}], length 0
23:24:22.864128 IP 142.188.231.51.60282 > 167.99.183.102.22: Flags [.], ack 3677220, win 8112, options [nop,nop,sack 2 {3677712:3678040}{3677384:3677548}], length 0
23:24:22.864128 IP 142.188.231.51.60282 > 167.99.183.102.22: Flags [.], ack 3677548, win 8110, options [nop,nop,sack 1 {3677712:3678040}], length 0
23:24:22.864128 IP 142.188.231.51.60282 > 167.99.183.102.22: Flags [.], ack 3678040, win 8109, length 0
23:24:22.864129 IP 142.188.231.51.60282 > 167.99.183.102.22: Flags [.], ack 3678204, win 8108, length 0
23:24:22.864129 IP 142.188.231.51.60282 > 167.99.183.102.22: Flags [.], ack 3678204, win 8108, options [nop,nop,sack 1 {3678368:3678532}], length 0
23:24:22.864160 IP 142.188.231.51.60282 > 167.99.183.102.22: Flags [.], ack 3678532, win 8107, length 0
23:24:22.864160 IP 142.188.231.51.60282 > 167.99.183.102.22: Flags [.], ack 3678860, win 8105, length 0
23:24:22.864160 IP 142.188.231.51.60282 > 167.99.183.102.22: Flags [.], ack 3679024, win 8105, options [nop,nop,sack 1 {3680116:3680280}], length 0
23:24:22.864160 IP 142.188.231.51.60282 > 167.99.183.102.22: Flags [.], ack 3680280, win 8100, length 0
23:24:22.864160 IP 142.188.231.51.60282 > 167.99.183.102.22: Flags [.], ack 3680444, win 8099, length 0
23:24:22.864160 IP 142.188.231.51.60282 > 167.99.183.102.22: Flags [.], ack 3680608, win 8098, options [nop,nop,sack 1 {3680936:3681100}], length 0
23:24:22.864161 IP 142.188.231.51.60282 > 167.99.183.102.22: Flags [.], ack 3680772, win 8098, options [nop,nop,sack 1 {3680936:3681100}], length 0
23:24:22.864161 IP 142.188.231.51.60282 > 167.99.183.102.22: Flags [.], ack 3680772, win 8098, options [nop,nop,sack 1 {3680936:3681872}], length 0
23:24:22.864179 IP 142.188.231.51.60282 > 167.99.183.102.22: Flags [.], ack 3681872, win 8094, length 0
23:24:22.864179 IP 142.188.231.51.60282 > 167.99.183.102.22: Flags [.], ack 3682036, win 8093, length 0
23:24:22.864478 IP 167.99.183.102.22 > 142.188.231.51.60282: Flags [P.], seq 3694216:3696700, ack 1477, win 501, length 2484
23:24:22.864619 IP 167.99.183.102.22 > 142.188.231.51.60282: Flags [P.], seq 3696700:3696864, ack 1477, win 501, length 164
23:24:22.864799 IP 167.99.183.102.22 > 142.188.231.51.60282: Flags [P.], seq 3696864:3697028, ack 1477, win 501, length 164
23:24:22.864936 IP 167.99.183.102.22 > 142.188.231.51.60282: Flags [P.], seq 3697028:3697192, ack 1477, win 501, length 164
23:24:22.865009 IP 167.99.183.102.22 > 142.188.231.51.60282: Flags [P.], seq 3697192:3697356, ack 1477, win 501, length 164
23:24:22.865035 IP 142.188.231.51.60282 > 167.99.183.102.22: Flags [.], ack 3682036, win 8093, options [nop,nop,sack 1 {3682200:3682364}], length 0
23:24:22.865035 IP 142.188.231.51.60282 > 167.99.183.102.22: Flags [.], ack 3682364, win 8092, length 0
23:24:22.865035 IP 142.188.231.51.60282 > 167.99.183.102.22: Flags [.], ack 3682692, win 8090, length 0
23:24:22.865036 IP 142.188.231.51.60282 > 167.99.183.102.22: Flags [.], ack 3682856, win 8090, options [nop,nop,sack 1 {3683020:3683184}], length 0
23:24:22.865036 IP 142.188.231.51.60282 > 167.99.183.102.22: Flags [.], ack 3683184, win 8088, length 0
23:24:22.865036 IP 142.188.231.51.60282 > 167.99.183.102.22: Flags [.], ack 3683184, win 8088, options [nop,nop,sack 1 {3683348:3683512}], length 0
23:24:22.865194 IP 167.99.183.102.22 > 142.188.231.51.60282: Flags [P.], seq 3697356:3698280, ack 1477, win 501, length 924
23:24:22.865269 IP 167.99.183.102.22 > 142.188.231.51.60282: Flags [P.], seq 3698280:3698444, ack 1477, win 501, length 164
23:24:22.865329 IP 167.99.183.102.22 > 142.188.231.51.60282: Flags [P.], seq 3698444:3698608, ack 1477, win 501, length 164
23:24:22.865385 IP 167.99.183.102.22 > 142.188.231.51.60282: Flags [P.], seq 3698608:3698772, ack 1477, win 501, length 164
23:24:22.865437 IP 167.99.183.102.22 > 142.188.231.51.60282: Flags [P.], seq 3698772:3698936, ack 1477, win 501, length 164
23:24:22.865490 IP 167.99.183.102.22 > 142.188.231.51.60282: Flags [P.], seq 3698936:3699100, ack 1477, win 501, length 164
23:24:22.865606 IP 167.99.183.102.22 > 142.188.231.51.60282: Flags [P.], seq 3699100:3699264, ack 1477, win 501, length 164
23:24:22.865737 IP 167.99.183.102.22 > 142.188.231.51.60282: Flags [P.], seq 3699264:3699428, ack 1477, win 501, length 164
23:24:22.865851 IP 167.99.183.102.22 > 142.188.231.51.60282: Flags [P.], seq 3699428:3699592, ack 1477, win 501, length 164
23:24:22.865911 IP 167.99.183.102.22 > 142.188.231.51.60282: Flags [P.], seq 3699592:3699756, ack 1477, win 501, length 164
23:24:22.865964 IP 167.99.183.102.22 > 142.188.231.51.60282: Flags [P.], seq 3699756:3699920, ack 1477, win 501, length 164
23:24:22.866018 IP 167.99.183.102.22 > 142.188.231.51.60282: Flags [P.], seq 3699920:3700084, ack 1477, win 501, length 164
23:24:22.866044 IP 142.188.231.51.60282 > 167.99.183.102.22: Flags [.], ack 3683512, win 8087, length 0
23:24:22.866044 IP 142.188.231.51.60282 > 167.99.183.102.22: Flags [.], ack 3683676, win 8087, length 0
23:24:22.866044 IP 142.188.231.51.60282 > 167.99.183.102.22: Flags [.], ack 3683676, win 8087, options [nop,nop,sack 1 {3683840:3684004}], length 0
23:24:22.866044 IP 142.188.231.51.60282 > 167.99.183.102.22: Flags [.], ack 3683676, win 8087, options [nop,nop,sack 2 {3684168:3684332}{3683840:3684004}], length 0
23:24:22.866044 IP 142.188.231.51.60282 > 167.99.183.102.22: Flags [.], ack 3683676, win 8087, options [nop,nop,sack 2 {3684168:3684496}{3683840:3684004}], length 0
23:24:22.866044 IP 142.188.231.51.60282 > 167.99.183.102.22: Flags [.], ack 3684004, win 8085, options [nop,nop,sack 1 {3684168:3684496}], length 0
23:24:22.866044 IP 142.188.231.51.60282 > 167.99.183.102.22: Flags [.], ack 3684496, win 8083, length 0
23:24:22.866044 IP 142.188.231.51.60282 > 167.99.183.102.22: Flags [.], ack 3684824, win 8082, length 0
23:24:22.866075 IP 142.188.231.51.60282 > 167.99.183.102.22: Flags [.], ack 3684824, win 8082, options [nop,nop,sack 1 {3684988:3685152}], length 0
23:24:22.866075 IP 142.188.231.51.60282 > 167.99.183.102.22: Flags [.], ack 3685152, win 8081, length 0
23:24:22.866271 IP 167.99.183.102.22 > 142.188.231.51.60282: Flags [P.], seq 3700084:3701552, ack 1477, win 501, length 1468
23:24:22.866337 IP 167.99.183.102.22 > 142.188.231.51.60282: Flags [P.], seq 3701552:3701716, ack 1477, win 501, length 164
23:24:22.866395 IP 167.99.183.102.22 > 142.188.231.51.60282: Flags [P.], seq 3701716:3701880, ack 1477, win 501, length 164
23:24:22.866451 IP 167.99.183.102.22 > 142.188.231.51.60282: Flags [P.], seq 3701880:3702044, ack 1477, win 501, length 164
23:24:22.866507 IP 167.99.183.102.22 > 142.188.231.51.60282: Flags [P.], seq 3702044:3702208, ack 1477, win 501, length 164
23:24:22.866563 IP 167.99.183.102.22 > 142.188.231.51.60282: Flags [P.], seq 3702208:3702372, ack 1477, win 501, length 164
23:24:22.866621 IP 167.99.183.102.22 > 142.188.231.51.60282: Flags [P.], seq 3702372:3702536, ack 1477, win 501, length 164
23:24:22.866732 IP 167.99.183.102.22 > 142.188.231.51.60282: Flags [P.], seq 3702536:3702700, ack 1477, win 501, length 164
23:24:22.866816 IP 167.99.183.102.22 > 142.188.231.51.60282: Flags [P.], seq 3702700:3702864, ack 1477, win 501, length 164
23:24:22.867051 IP 167.99.183.102.22 > 142.188.231.51.60282: Flags [P.], seq 3702864:3703028, ack 1477, win 501, length 164
23:24:22.867129 IP 167.99.183.102.22 > 142.188.231.51.60282: Flags [P.], seq 3703028:3703192, ack 1477, win 501, length 164
23:24:22.867154 IP 142.188.231.51.60282 > 167.99.183.102.22: Flags [.], ack 3685480, win 8079, length 0
23:24:22.867154 IP 142.188.231.51.60282 > 167.99.183.102.22: Flags [.], ack 3685644, win 8079, options [nop,nop,sack 1 {3685808:3685972}], length 0
23:24:22.867154 IP 142.188.231.51.60282 > 167.99.183.102.22: Flags [.], ack 3685972, win 8078, length 0
23:24:22.867154 IP 142.188.231.51.60282 > 167.99.183.102.22: Flags [.], ack 3686136, win 8077, length 0
23:24:22.867270 IP 167.99.183.102.22 > 142.188.231.51.60282: Flags [P.], seq 3703192:3703820, ack 1477, win 501, length 628
23:24:22.867378 IP 167.99.183.102.22 > 142.188.231.51.60282: Flags [P.], seq 3703820:3703984, ack 1477, win 501, length 164
23:24:22.867439 IP 167.99.183.102.22 > 142.188.231.51.60282: Flags [P.], seq 3703984:3704148, ack 1477, win 501, length 164
23:24:22.867547 IP 167.99.183.102.22 > 142.188.231.51.60282: Flags [P.], seq 3704148:3704312, ack 1477, win 501, length 164
23:24:22.867741 IP 167.99.183.102.22 > 142.188.231.51.60282: Flags [P.], seq 3704312:3704476, ack 1477, win 501, length 164
23:24:22.867830 IP 167.99.183.102.22 > 142.188.231.51.60282: Flags [P.], seq 3704476:3704640, ack 1477, win 501, length 164
23:24:22.867956 IP 167.99.183.102.22 > 142.188.231.51.60282: Flags [P.], seq 3704640:3704804, ack 1477, win 501, length 164
23:24:22.868022 IP 167.99.183.102.22 > 142.188.231.51.60282: Flags [P.], seq 3704804:3704968, ack 1477, win 501, length 164
23:24:22.868182 IP 167.99.183.102.22 > 142.188.231.51.60282: Flags [P.], seq 3704968:3705132, ack 1477, win 501, length 164
23:24:22.868329 IP 167.99.183.102.22 > 142.188.231.51.60282: Flags [P.], seq 3705132:3705296, ack 1477, win 501, length 164
23:24:22.868404 IP 167.99.183.102.22 > 142.188.231.51.60282: Flags [P.], seq 3705296:3705460, ack 1477, win 501, length 164
23:24:22.868515 IP 167.99.183.102.22 > 142.188.231.51.60282: Flags [P.], seq 3705460:3705624, ack 1477, win 501, length 164
23:24:22.868582 IP 167.99.183.102.22 > 142.188.231.51.60282: Flags [P.], seq 3705624:3705788, ack 1477, win 501, length 164
23:24:22.868649 IP 167.99.183.102.22 > 142.188.231.51.60282: Flags [P.], seq 3705788:3705952, ack 1477, win 501, length 164
23:24:22.868722 IP 167.99.183.102.22 > 142.188.231.51.60282: Flags [P.], seq 3705952:3706116, ack 1477, win 501, length 164
23:24:22.868797 IP 167.99.183.102.22 > 142.188.231.51.60282: Flags [P.], seq 3706116:3706280, ack 1477, win 501, length 164
23:24:22.868862 IP 167.99.183.102.22 > 142.188.231.51.60282: Flags [P.], seq 3706280:3706444, ack 1477, win 501, length 164
23:24:22.868969 IP 167.99.183.102.22 > 142.188.231.51.60282: Flags [P.], seq 3706444:3706608, ack 1477, win 501, length 164
23:24:22.869030 IP 167.99.183.102.22 > 142.188.231.51.60282: Flags [P.], seq 3706608:3706772, ack 1477, win 501, length 164
23:24:22.869088 IP 167.99.183.102.22 > 142.188.231.51.60282: Flags [P.], seq 3706772:3706936, ack 1477, win 501, length 164
23:24:22.869156 IP 167.99.183.102.22 > 142.188.231.51.60282: Flags [P.], seq 3706936:3707100, ack 1477, win 501, length 164
23:24:22.869222 IP 167.99.183.102.22 > 142.188.231.51.60282: Flags [P.], seq 3707100:3707264, ack 1477, win 501, length 164
23:24:22.869289 IP 167.99.183.102.22 > 142.188.231.51.60282: Flags [P.], seq 3707264:3707428, ack 1477, win 501, length 164
23:24:22.869378 IP 167.99.183.102.22 > 142.188.231.51.60282: Flags [P.], seq 3707428:3707592, ack 1477, win 501, length 164
23:24:22.869466 IP 167.99.183.102.22 > 142.188.231.51.60282: Flags [P.], seq 3707592:3707756, ack 1477, win 501, length 164
23:24:22.869527 IP 167.99.183.102.22 > 142.188.231.51.60282: Flags [P.], seq 3707756:3707920, ack 1477, win 501, length 164
23:24:22.869580 IP 167.99.183.102.22 > 142.188.231.51.60282: Flags [P.], seq 3707920:3708084, ack 1477, win 501, length 164
23:24:22.869633 IP 167.99.183.102.22 > 142.188.231.51.60282: Flags [P.], seq 3708084:3708248, ack 1477, win 501, length 164
23:24:22.869696 IP 167.99.183.102.22 > 142.188.231.51.60282: Flags [P.], seq 3708248:3708412, ack 1477, win 501, length 164
23:24:22.869760 IP 167.99.183.102.22 > 142.188.231.51.60282: Flags [P.], seq 3708412:3708576, ack 1477, win 501, length 164
23:24:22.869826 IP 167.99.183.102.22 > 142.188.231.51.60282: Flags [P.], seq 3708576:3708740, ack 1477, win 501, length 164
23:24:22.869915 IP 167.99.183.102.22 > 142.188.231.51.60282: Flags [P.], seq 3708740:3708904, ack 1477, win 501, length 164
23:24:22.869996 IP 167.99.183.102.22 > 142.188.231.51.60282: Flags [P.], seq 3708904:3709068, ack 1477, win 501, length 164
23:24:22.870060 IP 167.99.183.102.22 > 142.188.231.51.60282: Flags [P.], seq 3709068:3709232, ack 1477, win 501, length 164
23:24:22.870131 IP 167.99.183.102.22 > 142.188.231.51.60282: Flags [P.], seq 3709232:3709396, ack 1477, win 501, length 164
23:24:22.870381 IP 167.99.183.102.22 > 142.188.231.51.60282: Flags [P.], seq 3709396:3709560, ack 1477, win 501, length 164
23:24:22.870453 IP 167.99.183.102.22 > 142.188.231.51.60282: Flags [P.], seq 3709560:3709724, ack 1477, win 501, length 164
23:24:22.870510 IP 167.99.183.102.22 > 142.188.231.51.60282: Flags [P.], seq 3709724:3709888, ack 1477, win 501, length 164
23:24:22.870565 IP 167.99.183.102.22 > 142.188.231.51.60282: Flags [P.], seq 3709888:3710052, ack 1477, win 501, length 164
23:24:22.870618 IP 167.99.183.102.22 > 142.188.231.51.60282: Flags [P.], seq 3710052:3710216, ack 1477, win 501, length 164
23:24:22.870671 IP 167.99.183.102.22 > 142.188.231.51.60282: Flags [P.], seq 3710216:3710380, ack 1477, win 501, length 164
23:24:22.870727 IP 167.99.183.102.22 > 142.188.231.51.60282: Flags [P.], seq 3710380:3710544, ack 1477, win 501, length 164
23:24:22.870798 IP 167.99.183.102.22 > 142.188.231.51.60282: Flags [P.], seq 3710544:3710708, ack 1477, win 501, length 164
23:24:22.870862 IP 167.99.183.102.22 > 142.188.231.51.60282: Flags [P.], seq 3710708:3710872, ack 1477, win 501, length 164
23:24:22.871097 IP 167.99.183.102.22 > 142.188.231.51.60282: Flags [P.], seq 3710872:3711036, ack 1477, win 501, length 164
23:24:22.871156 IP 167.99.183.102.22 > 142.188.231.51.60282: Flags [P.], seq 3711036:3711200, ack 1477, win 501, length 164
23:24:22.871210 IP 167.99.183.102.22 > 142.188.231.51.60282: Flags [P.], seq 3711200:3711364, ack 1477, win 501, length 164
23:24:22.883091 IP 142.188.231.51.60282 > 167.99.183.102.22: Flags [.], ack 3686136, win 8077, options [nop,nop,sack 1 {3686300:3686464}], length 0
23:24:22.883091 IP 142.188.231.51.60282 > 167.99.183.102.22: Flags [.], ack 3686136, win 8077, options [nop,nop,sack 2 {3686628:3686792}{3686300:3686464}], length 0
23:24:22.883091 IP 142.188.231.51.60282 > 167.99.183.102.22: Flags [.], ack 3686464, win 8076, options [nop,nop,sack 1 {3686628:3686792}], length 0
23:24:22.883091 IP 142.188.231.51.60282 > 167.99.183.102.22: Flags [.], ack 3686792, win 8074, length 0
23:24:22.883174 IP 167.99.183.102.22 > 142.188.231.51.60282: Flags [P.], seq 3711364:3711528, ack 1477, win 501, length 164
23:24:22.883451 IP 167.99.183.102.22 > 142.188.231.51.60282: Flags [P.], seq 3711528:3712260, ack 1477, win 501, length 732
23:24:22.883547 IP 167.99.183.102.22 > 142.188.231.51.60282: Flags [P.], seq 3712260:3712424, ack 1477, win 501, length 164
23:24:22.883628 IP 167.99.183.102.22 > 142.188.231.51.60282: Flags [P.], seq 3712424:3712588, ack 1477, win 501, length 164
23:24:22.883720 IP 167.99.183.102.22 > 142.188.231.51.60282: Flags [P.], seq 3712588:3712752, ack 1477, win 501, length 164
23:24:22.884274 IP 142.188.231.51.60282 > 167.99.183.102.22: Flags [.], ack 3686792, win 8074, options [nop,nop,sack 1 {3686956:3687120}], length 0
23:24:22.884274 IP 142.188.231.51.60282 > 167.99.183.102.22: Flags [.], ack 3687120, win 8073, length 0
23:24:22.884274 IP 142.188.231.51.60282 > 167.99.183.102.22: Flags [.], ack 3687120, win 8073, options [nop,nop,sack 1 {3687284:3687448}], length 0
23:24:22.884274 IP 142.188.231.51.60282 > 167.99.183.102.22: Flags [.], ack 3687120, win 8073, options [nop,nop,sack 2 {3687612:3687776}{3687284:3687448}], length 0
23:24:22.884274 IP 142.188.231.51.60282 > 167.99.183.102.22: Flags [.], ack 3687448, win 8072, options [nop,nop,sack 1 {3687612:3687776}], length 0
23:24:22.884274 IP 142.188.231.51.60282 > 167.99.183.102.22: Flags [.], ack 3687776, win 8070, length 0
23:24:22.884274 IP 142.188.231.51.60282 > 167.99.183.102.22: Flags [.], ack 3689392, win 8064, length 0
23:24:22.884274 IP 142.188.231.51.60282 > 167.99.183.102.22: Flags [.], ack 3691336, win 8057, length 0
23:24:22.884310 IP 167.99.183.102.22 > 142.188.231.51.60282: Flags [P.], seq 3712752:3712916, ack 1477, win 501, length 164
23:24:22.884357 IP 142.188.231.51.60282 > 167.99.183.102.22: Flags [.], ack 3691664, win 8055, length 0
23:24:22.884357 IP 142.188.231.51.60282 > 167.99.183.102.22: Flags [.], ack 3691992, win 8054, length 0
23:24:22.884357 IP 142.188.231.51.60282 > 167.99.183.102.22: Flags [.], ack 3692576, win 8052, length 0
23:24:22.884357 IP 142.188.231.51.60282 > 167.99.183.102.22: Flags [.], ack 3692904, win 8050, length 0
23:24:22.884357 IP 142.188.231.51.60282 > 167.99.183.102.22: Flags [.], ack 3693068, win 8050, options [nop,nop,sack 1 {3693232:3693396}], length 0
23:24:22.884357 IP 142.188.231.51.60282 > 167.99.183.102.22: Flags [.], ack 3693396, win 8049, length 0
23:24:22.884357 IP 142.188.231.51.60282 > 167.99.183.102.22: Flags [.], ack 3693560, win 8048, length 0
23:24:22.884357 IP 142.188.231.51.60282 > 167.99.183.102.22: Flags [.], ack 3693724, win 8047, options [nop,nop,sack 1 {3693888:3694052}], length 0
23:24:22.884409 IP 142.188.231.51.60282 > 167.99.183.102.22: Flags [.], ack 3694052, win 8046, length 0
23:24:22.884409 IP 142.188.231.51.60282 > 167.99.183.102.22: Flags [.], ack 3694216, win 8045, length 0
23:24:22.884409 IP 142.188.231.51.60282 > 167.99.183.102.22: Flags [.], ack 3694216, win 8045, options [nop,nop,sack 1 {3695668:3696700}], length 0
23:24:22.884409 IP 142.188.231.51.60282 > 167.99.183.102.22: Flags [.], ack 3696700, win 8036, length 0
23:24:22.884409 IP 142.188.231.51.60282 > 167.99.183.102.22: Flags [.], ack 3696864, win 8035, options [nop,nop,sack 1 {3697028:3697192}], length 0
23:24:22.884410 IP 142.188.231.51.60282 > 167.99.183.102.22: Flags [.], ack 3696864, win 8035, options [nop,nop,sack 1 {3697028:3697356}], length 0
23:24:22.884410 IP 142.188.231.51.60282 > 167.99.183.102.22: Flags [.], ack 3697356, win 8033, length 0
23:24:22.884410 IP 142.188.231.51.60282 > 167.99.183.102.22: Flags [.], ack 3698280, win 8029, length 0
23:24:22.884438 IP 142.188.231.51.60282 > 167.99.183.102.22: Flags [.], ack 3698608, win 8028, length 0
23:24:22.884438 IP 142.188.231.51.60282 > 167.99.183.102.22: Flags [.], ack 3698936, win 8027, length 0
23:24:22.884438 IP 142.188.231.51.60282 > 167.99.183.102.22: Flags [.], ack 3699100, win 8026, options [nop,nop,sack 1 {3699264:3699428}], length 0
23:24:22.884438 IP 142.188.231.51.60282 > 167.99.183.102.22: Flags [.], ack 3699428, win 8025, length 0
23:24:22.884438 IP 142.188.231.51.60282 > 167.99.183.102.22: Flags [.], ack 3699592, win 8024, length 0
23:24:22.884438 IP 142.188.231.51.60282 > 167.99.183.102.22: Flags [.], ack 3699592, win 8024, options [nop,nop,sack 1 {3699756:3699920}], length 0
23:24:22.884438 IP 142.188.231.51.60282 > 167.99.183.102.22: Flags [.], ack 3699592, win 8024, options [nop,nop,sack 1 {3699756:3700084}], length 0
23:24:22.884991 IP 167.99.183.102.22 > 142.188.231.51.60282: Flags [P.], seq 3712916:3716880, ack 1477, win 501, length 3964
23:24:22.885039 IP 142.188.231.51.60282 > 167.99.183.102.22: Flags [.], ack 3705952, win 7999, length 0
23:24:22.885126 IP 167.99.183.102.22 > 142.188.231.51.60282: Flags [P.], seq 3716880:3717148, ack 1477, win 501, length 268
23:24:22.885168 IP 142.188.231.51.60282 > 167.99.183.102.22: Flags [.], ack 3706280, win 7998, length 0
23:24:22.885168 IP 142.188.231.51.60282 > 167.99.183.102.22: Flags [.], ack 3706280, win 7998, options [nop,nop,sack 1 {3706444:3706608}], length 0
23:24:22.885168 IP 142.188.231.51.60282 > 167.99.183.102.22: Flags [.], ack 3706608, win 7997, length 0
23:24:22.885168 IP 142.188.231.51.60282 > 167.99.183.102.22: Flags [.], ack 3706608, win 7997, options [nop,nop,sack 1 {3706772:3706936}], length 0
23:24:22.885169 IP 142.188.231.51.60282 > 167.99.183.102.22: Flags [.], ack 3706936, win 7996, length 0
23:24:22.885169 IP 142.188.231.51.60282 > 167.99.183.102.22: Flags [.], ack 3707100, win 7995, options [nop,nop,sack 1 {3707264:3707428}], length 0
23:24:22.885169 IP 142.188.231.51.60282 > 167.99.183.102.22: Flags [.], ack 3707428, win 7994, length 0
23:24:22.885169 IP 142.188.231.51.60282 > 167.99.183.102.22: Flags [.], ack 3707428, win 7994, options [nop,nop,sack 1 {3707592:3707756}], length 0
23:24:22.885206 IP 142.188.231.51.60282 > 167.99.183.102.22: Flags [.], ack 3707756, win 7992, length 0
23:24:22.885206 IP 142.188.231.51.60282 > 167.99.183.102.22: Flags [.], ack 3707920, win 7992, length 0
23:24:22.885206 IP 142.188.231.51.60282 > 167.99.183.102.22: Flags [.], ack 3707920, win 7992, options [nop,nop,sack 1 {3708084:3708248}], length 0
23:24:22.885206 IP 142.188.231.51.60282 > 167.99.183.102.22: Flags [.], ack 3708248, win 7991, length 0
23:24:22.885206 IP 142.188.231.51.60282 > 167.99.183.102.22: Flags [.], ack 3708248, win 7991, options [nop,nop,sack 1 {3708412:3708576}], length 0
23:24:22.885206 IP 142.188.231.51.60282 > 167.99.183.102.22: Flags [.], ack 3708576, win 7989, length 0
23:24:22.885206 IP 142.188.231.51.60282 > 167.99.183.102.22: Flags [.], ack 3708740, win 7989, options [nop,nop,sack 1 {3708904:3709068}], length 0
23:24:22.885206 IP 142.188.231.51.60282 > 167.99.183.102.22: Flags [.], ack 3709068, win 7987, length 0
23:24:22.885237 IP 142.188.231.51.60282 > 167.99.183.102.22: Flags [.], ack 3709232, win 7987, length 0
23:24:22.885237 IP 142.188.231.51.60282 > 167.99.183.102.22: Flags [.], ack 3709396, win 7986, options [nop,nop,sack 1 {3709560:3709724}], length 0
23:24:22.885237 IP 142.188.231.51.60282 > 167.99.183.102.22: Flags [.], ack 3709724, win 7985, length 0
23:24:22.885237 IP 142.188.231.51.60282 > 167.99.183.102.22: Flags [.], ack 3709888, win 7984, length 0
23:24:22.885237 IP 142.188.231.51.60282 > 167.99.183.102.22: Flags [.], ack 3710052, win 7983, options [nop,nop,sack 1 {3710216:3710380}], length 0
23:24:22.885237 IP 142.188.231.51.60282 > 167.99.183.102.22: Flags [.], ack 3710380, win 7982, length 0
23:24:22.885237 IP 142.188.231.51.60282 > 167.99.183.102.22: Flags [.], ack 3710380, win 7982, options [nop,nop,sack 1 {3710544:3710708}], length 0
23:24:22.885237 IP 142.188.231.51.60282 > 167.99.183.102.22: Flags [.], ack 3710380, win 7982, options [nop,nop,sack 2 {3710872:3711036}{3710544:3710708}], length 0
23:24:22.885258 IP 142.188.231.51.60282 > 167.99.183.102.22: Flags [.], ack 3710380, win 7982, options [nop,nop,sack 2 {3710872:3711200}{3710544:3710708}], length 0
23:24:22.885258 IP 142.188.231.51.60282 > 167.99.183.102.22: Flags [.], ack 3710708, win 7981, options [nop,nop,sack 1 {3710872:3711200}], length 0
23:24:22.885258 IP 142.188.231.51.60282 > 167.99.183.102.22: Flags [.], ack 3711200, win 7979, length 0
23:24:22.885258 IP 142.188.231.51.60282 > 167.99.183.102.22: Flags [.], ack 3711364, win 7978, length 0
23:24:22.885644 IP 167.99.183.102.22 > 142.188.231.51.60282: Flags [P.], seq 3717148:3720856, ack 1477, win 501, length 3708
23:24:22.885750 IP 167.99.183.102.22 > 142.188.231.51.60282: Flags [P.], seq 3720856:3721020, ack 1477, win 501, length 164
23:24:22.885816 IP 167.99.183.102.22 > 142.188.231.51.60282: Flags [P.], seq 3721020:3721184, ack 1477, win 501, length 164
23:24:22.885876 IP 167.99.183.102.22 > 142.188.231.51.60282: Flags [P.], seq 3721184:3721348, ack 1477, win 501, length 164
23:24:22.885934 IP 167.99.183.102.22 > 142.188.231.51.60282: Flags [P.], seq 3721348:3721512, ack 1477, win 501, length 164
23:24:22.885992 IP 167.99.183.102.22 > 142.188.231.51.60282: Flags [P.], seq 3721512:3721676, ack 1477, win 501, length 164
23:24:22.886049 IP 167.99.183.102.22 > 142.188.231.51.60282: Flags [P.], seq 3721676:3721840, ack 1477, win 501, length 164
23:24:22.886107 IP 167.99.183.102.22 > 142.188.231.51.60282: Flags [P.], seq 3721840:3722004, ack 1477, win 501, length 164
23:24:22.886165 IP 167.99.183.102.22 > 142.188.231.51.60282: Flags [P.], seq 3722004:3722168, ack 1477, win 501, length 164
23:24:22.886222 IP 167.99.183.102.22 > 142.188.231.51.60282: Flags [P.], seq 3722168:3722332, ack 1477, win 501, length 164
23:24:22.886279 IP 167.99.183.102.22 > 142.188.231.51.60282: Flags [P.], seq 3722332:3722496, ack 1477, win 501, length 164
23:24:22.886349 IP 167.99.183.102.22 > 142.188.231.51.60282: Flags [P.], seq 3722496:3722660, ack 1477, win 501, length 164
23:24:22.886407 IP 167.99.183.102.22 > 142.188.231.51.60282: Flags [P.], seq 3722660:3722824, ack 1477, win 501, length 164
23:24:22.886470 IP 167.99.183.102.22 > 142.188.231.51.60282: Flags [P.], seq 3722824:3722988, ack 1477, win 501, length 164
23:24:22.886539 IP 167.99.183.102.22 > 142.188.231.51.60282: Flags [P.], seq 3722988:3723152, ack 1477, win 501, length 164
23:24:22.886596 IP 167.99.183.102.22 > 142.188.231.51.60282: Flags [P.], seq 3723152:3723316, ack 1477, win 501, length 164
23:24:22.886665 IP 167.99.183.102.22 > 142.188.231.51.60282: Flags [P.], seq 3723316:3723480, ack 1477, win 501, length 164
23:24:22.886752 IP 167.99.183.102.22 > 142.188.231.51.60282: Flags [P.], seq 3723480:3723644, ack 1477, win 501, length 164
23:24:22.886815 IP 167.99.183.102.22 > 142.188.231.51.60282: Flags [P.], seq 3723644:3723808, ack 1477, win 501, length 164
23:24:22.886860 IP 167.99.183.102.22 > 142.188.231.51.60282: Flags [P.], seq 3723808:3723972, ack 1477, win 501, length 164
23:24:22.887061 IP 167.99.183.102.22 > 142.188.231.51.60282: Flags [P.], seq 3723972:3724136, ack 1477, win 501, length 164
23:24:22.887113 IP 167.99.183.102.22 > 142.188.231.51.60282: Flags [P.], seq 3724136:3724300, ack 1477, win 501, length 164
23:24:22.887181 IP 167.99.183.102.22 > 142.188.231.51.60282: Flags [P.], seq 3724300:3724464, ack 1477, win 501, length 164
23:24:22.887249 IP 167.99.183.102.22 > 142.188.231.51.60282: Flags [P.], seq 3724464:3724628, ack 1477, win 501, length 164
23:24:22.887306 IP 167.99.183.102.22 > 142.188.231.51.60282: Flags [P.], seq 3724628:3724792, ack 1477, win 501, length 164
23:24:22.887351 IP 167.99.183.102.22 > 142.188.231.51.60282: Flags [P.], seq 3724792:3724956, ack 1477, win 501, length 164
23:24:22.887394 IP 167.99.183.102.22 > 142.188.231.51.60282: Flags [P.], seq 3724956:3725120, ack 1477, win 501, length 164
23:24:22.887438 IP 167.99.183.102.22 > 142.188.231.51.60282: Flags [P.], seq 3725120:3725284, ack 1477, win 501, length 164
23:24:22.887483 IP 167.99.183.102.22 > 142.188.231.51.60282: Flags [P.], seq 3725284:3725448, ack 1477, win 501, length 164
23:24:22.887538 IP 167.99.183.102.22 > 142.188.231.51.60282: Flags [P.], seq 3725448:3725612, ack 1477, win 501, length 164
23:24:22.887600 IP 167.99.183.102.22 > 142.188.231.51.60282: Flags [P.], seq 3725612:3725776, ack 1477, win 501, length 164
23:24:22.887675 IP 167.99.183.102.22 > 142.188.231.51.60282: Flags [P.], seq 3725776:3725940, ack 1477, win 501, length 164
23:24:22.887725 IP 167.99.183.102.22 > 142.188.231.51.60282: Flags [P.], seq 3725940:3726104, ack 1477, win 501, length 164
23:24:22.887769 IP 167.99.183.102.22 > 142.188.231.51.60282: Flags [P.], seq 3726104:3726268, ack 1477, win 501, length 164
23:24:22.887814 IP 167.99.183.102.22 > 142.188.231.51.60282: Flags [P.], seq 3726268:3726432, ack 1477, win 501, length 164
23:24:22.887885 IP 167.99.183.102.22 > 142.188.231.51.60282: Flags [P.], seq 3726432:3726596, ack 1477, win 501, length 164
23:24:22.887945 IP 167.99.183.102.22 > 142.188.231.51.60282: Flags [P.], seq 3726596:3726760, ack 1477, win 501, length 164
23:24:22.888022 IP 167.99.183.102.22 > 142.188.231.51.60282: Flags [P.], seq 3726760:3726924, ack 1477, win 501, length 164
23:24:22.888083 IP 167.99.183.102.22 > 142.188.231.51.60282: Flags [P.], seq 3726924:3727088, ack 1477, win 501, length 164
23:24:22.888143 IP 167.99.183.102.22 > 142.188.231.51.60282: Flags [P.], seq 3727088:3727252, ack 1477, win 501, length 164
23:24:22.888201 IP 167.99.183.102.22 > 142.188.231.51.60282: Flags [P.], seq 3727252:3727416, ack 1477, win 501, length 164
23:24:22.888260 IP 167.99.183.102.22 > 142.188.231.51.60282: Flags [P.], seq 3727416:3727580, ack 1477, win 501, length 164
23:24:22.888318 IP 167.99.183.102.22 > 142.188.231.51.60282: Flags [P.], seq 3727580:3727744, ack 1477, win 501, length 164
23:24:22.888383 IP 167.99.183.102.22 > 142.188.231.51.60282: Flags [P.], seq 3727744:3727908, ack 1477, win 501, length 164
23:24:22.888442 IP 167.99.183.102.22 > 142.188.231.51.60282: Flags [P.], seq 3727908:3728072, ack 1477, win 501, length 164
23:24:22.888500 IP 167.99.183.102.22 > 142.188.231.51.60282: Flags [P.], seq 3728072:3728236, ack 1477, win 501, length 164
23:24:22.888558 IP 167.99.183.102.22 > 142.188.231.51.60282: Flags [P.], seq 3728236:3728400, ack 1477, win 501, length 164
23:24:22.888615 IP 167.99.183.102.22 > 142.188.231.51.60282: Flags [P.], seq 3728400:3728564, ack 1477, win 501, length 164
23:24:22.888673 IP 167.99.183.102.22 > 142.188.231.51.60282: Flags [P.], seq 3728564:3728728, ack 1477, win 501, length 164
23:24:22.888738 IP 167.99.183.102.22 > 142.188.231.51.60282: Flags [P.], seq 3728728:3728892, ack 1477, win 501, length 164
23:24:22.888795 IP 167.99.183.102.22 > 142.188.231.51.60282: Flags [P.], seq 3728892:3729056, ack 1477, win 501, length 164
23:24:22.888853 IP 167.99.183.102.22 > 142.188.231.51.60282: Flags [P.], seq 3729056:3729220, ack 1477, win 501, length 164
23:24:22.888917 IP 167.99.183.102.22 > 142.188.231.51.60282: Flags [P.], seq 3729220:3729384, ack 1477, win 501, length 164
23:24:22.888975 IP 167.99.183.102.22 > 142.188.231.51.60282: Flags [P.], seq 3729384:3729548, ack 1477, win 501, length 164
23:24:22.889033 IP 167.99.183.102.22 > 142.188.231.51.60282: Flags [P.], seq 3729548:3729712, ack 1477, win 501, length 164
23:24:22.889075 IP 142.188.231.51.60282 > 167.99.183.102.22: Flags [.], ack 3711528, win 7978, options [nop,nop,sack 1 {3712260:3712424}], length 0
23:24:22.889076 IP 142.188.231.51.60282 > 167.99.183.102.22: Flags [.], ack 3711528, win 7978, options [nop,nop,sack 2 {3712588:3712752}{3712260:3712424}], length 0
23:24:22.889076 IP 142.188.231.51.60282 > 167.99.183.102.22: Flags [.], ack 3712424, win 7974, options [nop,nop,sack 1 {3712588:3712752}], length 0
23:24:22.889076 IP 142.188.231.51.60282 > 167.99.183.102.22: Flags [.], ack 3712752, win 7973, length 0
23:24:22.889076 IP 142.188.231.51.60282 > 167.99.183.102.22: Flags [.], ack 3712916, win 7972, length 0
23:24:22.889226 IP 167.99.183.102.22 > 142.188.231.51.60282: Flags [P.], seq 3729712:3730548, ack 1477, win 501, length